20140904 5:55PM UTC,Interpublic Group to Present at the Goldman Sachs 23rd Annual Communacopia Conference,http://www.reuters.com/article/2014/09/03/idUSnHUGjc8rca+1c0+ONE20140903,
20140904 4:56PM UTC,Clear Channel to Present at the 2014 Goldman Sachs Communacopia Conference,http://www.reuters.com/article/2014/09/03/tx-clear-channel-comm-idUSnBw036695a+100+BSW20140903,
20140904 4:30PM UTC,TiVo to Present at 23rd Annual Goldman Sachs Communacopia Conference,http://www.reuters.com/article/2014/09/03/idUSnMKWXnZBja+1ec+MKW20140903,
20140904 4:15PM UTC,"Nielsen to Present at Goldman Sachs Communacopia Conference on September 11, 2014",http://www.reuters.com/article/2014/09/03/ny-nielsen-idUSnBw036630a+100+BSW20140903,
20140904 3:00PM UTC,CBS Corporation President And Chief Executive Officer Leslie Moonves To Participate In The Goldman Sachs 23rd Annual Communacopia Conference,http://www.reuters.com/article/2014/09/03/ny-cbss-moonvesconf-idUSnPn6Z0xSZ+93+PRN20140903,
20140904 9:01AM UTC,Criteo to Present at the Goldman Sachs 23rd Annual Communacopia Conference,http://www.reuters.com/article/2014/09/03/idUSnGNX3xJJ9H+1cd+GNW20140903,
20140904 9:00AM UTC,Viacom President and Chief Executive Officer Philippe Dauman to Appear at Goldman Sachs Communacopia Conference,http://www.reuters.com/article/2014/09/03/ny-viacom-idUSnBw035009a+100+BSW20140903,
20140904 8:00AM UTC,Gartner to Present at Goldman Sachs Communacopia Investor Conference,http://www.reuters.com/article/2014/09/03/ct-gartner-idUSnBw035208a+100+BSW20140903,
20140904 7:00AM UTC,CBS Outdoor Chief Executive Officer Jeremy Male to Participate in the Goldman Sachs Communacopia Conference,http://www.reuters.com/article/2014/09/03/ny-cbs-outdoor-americas-idUSnBw035294a+100+BSW20140903,
20140905 5:00PM UTC,American Tower to Present at the Goldman Sachs 23rd Annual Communacopia Conference,http://www.reuters.com/article/2014/09/04/ma-american-tower-idUSnBw046292a+100+BSW20140904,
20140905 4:50PM UTC,"Liberty TripAdvisor Holdings, Inc. to Present at Goldman Sachs Twenty-Third Annual Communacopia Conference",http://www.reuters.com/article/2014/09/04/co-liberty-tripadvisor-idUSnBw046380a+100+BSW20140904,
20140905 4:20PM UTC,Liberty Media Corporation to Present at Goldman Sachs Twenty-Third Annual Communacopia Conference,http://www.reuters.com/article/2014/09/04/co-liberty-media-idUSnBw046343a+100+BSW20140904,
20140905 4:15PM UTC,Discovery Communications President And CEO David Zaslav to Present at Goldman Sachs' 23rd Annual Communacopia Conference,http://www.reuters.com/article/2014/09/04/discoverygoldmanconf-idUSnPnQ8Zvx+54+PRN20140904,
20140905 4:14PM UTC,Liberty Interactive Corporation to Present at Goldman Sachs Twenty-Third Annual Communacopia Conference,http://www.reuters.com/article/2014/09/04/co-liberty-interactive-idUSnBw046341a+100+BSW20140904,
20140905 4:05PM UTC,Pandora Chief Financial Officer to Present at the Goldman Sachs 23rd Annual Communacopia Conference,http://www.reuters.com/article/2014/09/04/ca-pandora-idUSnBw045863a+100+BSW20140904,
20140905 12:03PM UTC,Goldman Sachs plans debut sukuk issue as Islamic finance goes mainstream,http://www.reuters.com/article/2014/09/04/us-goldman-sukuk-idUSKBN0GZ1CM20140904,
20140905 12:00PM UTC,Starz to Present at Goldman Sachs Twenty-Third Annual Communacopia Conference,http://www.reuters.com/article/2014/09/04/co-starz-idUSnBw045127a+100+BSW20140904,
20140905 11:58AM UTC,UPDATE 3-Goldman Sachs plans debut sukuk issue as Islamic finance goes mainstream,http://www.reuters.com/article/2014/09/04/goldman-sukuk-idUSL5N0R513N20140904,
20140905 10:27AM UTC,Lamar Advertising to Appear at the Goldman Sachs 23rd Annual Communacopia Conference,http://www.reuters.com/article/2014/09/04/idUSnGNX35pdZh+1c2+GNW20140904,
20140905 10:20AM UTC,Higher One to Present at Goldman Sachs Fourth Annual Financial Technology Conference,http://www.reuters.com/article/2014/09/04/ct-higher-one-holdings-idUSnBw045805a+100+BSW20140904,
20140905 9:15AM UTC,Fitch Expects to Rate Goldman Sachs' Sukuk Programme 'A',http://www.reuters.com/article/2014/09/04/ny-fitch-ratings-goldman-idUSnBw045670a+100+BSW20140904,
20140905 9:00AM UTC,MDC Partners to Present at the Goldman Sachs 23rd Annual Communacopia Conference,http://www.reuters.com/article/2014/09/04/mdc-communacopia-idUSnPn3wDzrr+88+PRN20140904,
20140905 8:30AM UTC,Intelsatâ€™s Chief Financial Officer to Present at Goldman Sachs 23rd Annual Communacopia Conference,http://www.reuters.com/article/2014/09/04/intelsat-idUSnBw045053a+100+BSW20140904,
20140905 7:56AM UTC,Goldman Sachs wins role stabilizing early trade in Alibaba IPO: source,http://www.reuters.com/article/2014/09/04/us-alibaba-group-ipo-idUSKBN0GZ1AM20140904,
20140905 3:25AM UTC,Goldman Sachs plans benchmark-size dollar sukuk issue -leads,http://www.reuters.com/article/2014/09/04/goldman-sukuk-idUSL5N0R50XM20140904,
20140906 3:50PM UTC,Gannett to present at Goldman Sachs Communacopia Conference,http://www.reuters.com/article/2014/09/05/gannettcommunacopia-idUSnPn3qtDmX+85+PRN20140905,
20140906 2:47PM UTC,Charter to Participate in Goldman Sachs Communacopia Conference,http://www.reuters.com/article/2014/09/05/ct-chtr-goldmansachs-idUSnPn3yT4ZN+8b+PRN20140905,
20140906 9:30AM UTC,AT&T; to Webcast Presentation by Ralph de la Vega at Goldman Sachs Conference on September 12,http://www.reuters.com/article/2014/09/05/tx-att-idUSnBw055048a+100+BSW20140905,
20140906 8:45AM UTC,"Upcoming Conferences, Anniversary Celebrations, Financial Grants, and Market Updates - Research Reports on Visa, Goldman Sachs, Amex, Regions and Hertz",http://www.reuters.com/article/2014/09/05/bc-analysts-review-idUSnPnb2MG8z+8c+PRN20140905,
20140910 6:00PM UTC,Liberty Global to Present at the Goldman Sachs 23rd Annual Communacopia Conference,http://www.reuters.com/article/2014/09/09/co-liberty-global-idUSnBw096776a+100+BSW20140909,
20140910 11:27AM UTC,News Corp to Participate in Goldman Sachs Communacopia Conference,http://www.reuters.com/article/2014/09/09/ny-news-corp-idUSnBw096221a+100+BSW20140909,
20140910 9:30AM UTC,"The Zacks Analyst Blog Highlights: Citigroup, Goldman Sachs Group, JPMorgan Chase, Bank of America and HSBC Holdings",http://www.reuters.com/article/2014/09/09/il-zacks-investment-idUSnPn4tktXY+83+PRN20140909,
20140911 1:52PM UTC,NY pension fund enters $2 billion investment venture with Goldman Sachs,http://www.reuters.com/article/2014/09/10/us-goldman-nypensionfund-idUSKBN0H520S20140910,
20140911 1:45PM UTC,NY pension fund enters $2 billion investment venture with Goldman Sachs,http://www.reuters.com/article/2014/09/10/goldman-nypensionfund-idUSL1N0RB18B20140910,
20140911 11:00AM UTC,IMAX Corporation To Present At The Goldman Sachs 23rd Annual Communacopia Conference,http://www.reuters.com/article/2014/09/10/ny-imaxcommunacopia-idUSnPn9SCQ5M+9d+PRN20140910,
20140911 8:45AM UTC,Verizon Chairman and CEO to Speak at Goldman Sachs Conference on Sept. 11,http://www.reuters.com/article/2014/09/10/ny-verizongoldmanconf-idUSnPn5LZrcD+99+PRN20140910,
20140911 8:27AM UTC,US STOCKS-Goldman Sachs recommends Kroger calls ahead of earnings,http://www.reuters.com/article/2014/09/10/markets-usa-stocks-idUSL1N0RB0R120140910,
20140912 9:30AM UTC,"The Zacks Analyst Blog Highlights: Goldman Sachs Group, Citigroup, Bank of America, Wells Fargo and JPMorgan Chase",http://www.reuters.com/article/2014/09/11/il-zacks-investment-idUSnPn9zH0Kd+8a+PRN20140911,
20140912 7:30AM UTC,"T-Mobile US, Inc. to Present at the Goldman Sachs 23rd Annual Communacopia Conference",http://www.reuters.com/article/2014/09/11/wa-t-mobile-idUSnBw115136a+100+BSW20140911,
20140916 9:30AM UTC,"The Zacks Analyst Blog Highlights: Citigroup, BB&T;, Goldman Sachs Group, Bank of America and JPMorgan Chase",http://www.reuters.com/article/2014/09/15/il-zacksinvestment-idUSnPn3zVTHH+8f+PRN20140915,
20140916 9:20AM UTC,"New Service, Chairman's Statement, Dividend, Joint Product Launch, and New Program - Research Reports on Visa, Goldman Sachs, AvalonBay, American Express and Regions",http://www.reuters.com/article/2014/09/15/bc-analysts-review-idUSnPn3lZsFb+8a+PRN20140915,
20140917 1:00PM UTC,Goldman Sachs gets strong demand for landmark sukuk issue ,http://www.reuters.com/article/2014/09/16/us-goldman-sukuk-launch-idUSKBN0HB14K20140916,
20140917 1:00PM UTC,Goldman Sachs revises price guidance on debut sukuk; books at $1.4 billion: leads,http://www.reuters.com/article/2014/09/16/us-goldman-sukuk-idUSKBN0HB0V120140916,
20140917 12:58PM UTC,UPDATE 1-Goldman Sachs gets strong demand for landmark sukuk issue,http://www.reuters.com/article/2014/09/16/goldman-sukuk-launch-idUSL6N0RH2RH20140916,
20140917 7:50AM UTC,Goldman Sachs-Led Investor Group Backs Privia Health for National Expansion,http://www.reuters.com/article/2014/09/16/va-privia-health-idUSnBw165224a+100+BSW20140916,
20140917 7:17AM UTC,"Goldman Sachs launches $500 mln, 5-yr sukuk; pricing at tight end",http://www.reuters.com/article/2014/09/16/goldman-sukuk-launch-idUSL6N0RH2EZ20140916,
20140917 5:34AM UTC,Goldman Sachs revises price guidance on debut sukuk; books at $1.4 bln - leads,http://www.reuters.com/article/2014/09/16/goldman-sukuk-idUSL6N0RH14120140916,
20140917 1:26AM UTC,Goldman Sachs sets IPT in 95 bps area over M/S for USD sukuk,http://www.reuters.com/article/2014/09/16/goldman-sachs-sukuk-idUSL6N0RF0FX20140916,
20140919 10:14PM UTC,SEC probing Goldman Sachs internship for brother of Libyan ex-official: WSJ,http://www.reuters.com/article/2014/09/19/us-goldmansachs-libya-sec-probe-idUSKBN0HE05P20140919,
20140919 10:11PM UTC,U.S. SEC probing Goldman Sachs internship for brother of Libyan ex-official -WSJ,http://www.reuters.com/article/2014/09/19/goldmansachs-libya-sec-probe-idUSL3N0RK0SM20140919,
20140919 2:26AM UTC,Middle East banks buy vast majority of landmark Goldman Sachs sukuk,http://www.reuters.com/article/2014/09/18/goldman-sukuk-idUSL6N0RJ0HU20140918,
20140920 9:30AM UTC,"The Zacks Analyst Blog Highlights: China Petroleum and Chemical, China Mobile, Goldman Sachs Group, ReneSola and Baidu",http://www.reuters.com/article/2014/09/19/il-zacks-investment-idUSnPn1ccgQL+83+PRN20140919,
20140923 6:23PM UTC,"Goldman Sachs files for active ETFs, joins Wall Street bank trend",http://www.reuters.com/article/2014/09/22/us-goldman-etfs-idUSKCN0HH2U620140922,
20140923 6:17PM UTC,"Goldman Sachs files for active ETFs, joins Wall Street bank trend",http://www.reuters.com/article/2014/09/22/goldman-etfs-idUSL2N0RN1N720140922,
20140923 9:30AM UTC,"The Zacks Analyst Blog Highlights: Citigroup, Bank of America,Goldman Sachs Group, Morgan Stanley and JPMorgan Chase",http://www.reuters.com/article/2014/09/22/zacks-analyst-blog-idUSnPn4nmDqb+84+PRN20140922,
20140924 10:30AM UTC,Goldman Sachs head of European FX trading to leave: source,http://www.reuters.com/article/2014/09/23/us-markets-fx-trader-idUSKCN0HI1KG20140923,
20140924 10:27AM UTC,Goldman Sachs head of European FX trading to leave -source,http://www.reuters.com/article/2014/09/23/markets-fx-trader-idUSL6N0RO43T20140923,
20140924 9:30AM UTC,"The Zacks Analyst Blog Highlights: Goldman Sachs Group, JPMorgan Chase, Moelis, Stifel Financial and Evercore Partners",http://www.reuters.com/article/2014/09/23/il-zacks-investment-idUSnPn50TXkP+8d+PRN20140923,
20140924 9:30AM UTC,"The Zacks Analyst Blog Highlights: Royal Bank of Scotland Group, Morgan Stanley, Goldman Sachs Group, JPMorgan Chase and Caterpillar",http://www.reuters.com/article/2014/09/23/il-zacksinvestment-idUSnPn172c7y+80+PRN20140923,
20140926 7:58PM UTC,Goldman Sachs and Senrigan to Provide Financing,http://www.reuters.com/article/2014/09/25/idUSnGNXbb0xVV+1c3+GNW20140925,
20140926 3:10PM UTC,Context Relevant Announces $13.5 Million in Series B-1 Funding and Strategic Partnerships With Bank of America Merrill Lynch & Goldman Sachs,http://www.reuters.com/article/2014/09/25/wa-context-relevant-idUSnBw256190a+100+BSW20140925,
20140926 8:13AM UTC,New Issue- Goldman Sachs prices 1.0 bln euro 2024 bond,http://www.reuters.com/article/2014/09/25/idUSL3N0RQ43120140925,
20140930 8:00AM UTC,"Goldman Sachs Names Jyoti Bansal, Founder & CEO of AppDynamics, as One of the 100 Most Intriguing Entrepreneurs"" at Third Annual Builders + Innovators Summit""",http://www.reuters.com/article/2014/09/29/idUSnMKWYlHXCa+1ee+MKW20140929,
20141001 2:47PM UTC,Goldman Sachs Asset Management Launches GS Long Short Fund,http://www.reuters.com/article/2014/09/30/ny-gsam-idUSnBw306620a+100+BSW20140930,
20141002 10:46AM UTC,"Goldman Sachs lowers CBOT soy, corn, wheat price forecasts",http://www.reuters.com/article/2014/10/01/markets-grains-goldman-idUSL2N0RW0ZB20141001,
20141003 4:13PM UTC,RBS hires Goldman Sachs to seek buyers for Coutts International: FT,http://www.reuters.com/article/2014/10/02/us-coutts-divestiture-idUSKCN0HR2DO20141002,
20141003 4:08PM UTC,RBS hires Goldman Sachs to seek buyers for Coutts International - FT,http://www.reuters.com/article/2014/10/02/coutts-divestiture-idUSL3N0RX3ND20141002,
20141004 11:30AM UTC,BRP Companies and Goldman Sachs Urban Investment Group's $75M Joint Venture Will Leverage Quarter Billion Dollars in New Residential Development,http://www.reuters.com/article/2014/10/03/idUSnMKW2j4wsa+1c0+MKW20141003,
20141008 3:30PM UTC,Goldman Sachs ordered to pay Libyan fund's legal costs,http://www.reuters.com/article/2014/10/07/us-goldmansachs-libya-idUSKCN0HW1YV20141007,
20141008 3:27PM UTC,Goldman Sachs ordered to pay Libyan fund's legal costs,http://www.reuters.com/article/2014/10/07/goldmansachs-libya-idUSL6N0S22QX20141007,
20141008 9:30AM UTC,"The Zacks Analyst Blog Highlights: HSBC Holdings, Credit Suisse Group, Goldman Sachs Group, JPMorgan Chase and Tesla Motors",http://www.reuters.com/article/2014/10/07/il-zacks-investment-idUSnPn8vrvzw+80+PRN20141007,
20141010 11:10AM UTC,Goldman Sachs Asset Management Strengthens Overall Fixed Income Fund Platform,http://www.reuters.com/article/2014/10/09/ny-gsam-idUSnBw095904a+100+BSW20141009,
20141010 8:40AM UTC,"Technical Pulse on Investment Banking and Brokerage Stocks - Charles Schwab, E*TRADE, TD Ameritrade, Goldman Sachs, and LPL Financial",http://www.reuters.com/article/2014/10/09/bc-investor-edge-idUSnPn6nBfxD+89+PRN20141009,
20141010 8:00AM UTC,Digital Reasoning Raises $24 Million in Series C Round Led by Goldman Sachs & Credit Suisse Next Investors,http://www.reuters.com/article/2014/10/09/tn-digital-reasoning-idUSnBw095259a+100+BSW20141009,
20141011 4:30PM UTC,Goldman Sachs Declares Preferred Stock Dividends,http://www.reuters.com/article/2014/10/10/ny-goldman-sachs-idUSnBw105486a+100+BSW20141010,
20141011 9:29AM UTC,"Zacks Industry Outlook Highlights: Bank of America, J.P. Morgan, Wells Fargo, Citigroup and Goldman Sachs",http://www.reuters.com/article/2014/10/10/zacks-industryoutlook-idUSnPn2LYrVQ+9b+PRN20141010,
20141014 9:15AM UTC,"Scheduled Earnings, Service Launches, and Technical Updates - Research Reports on Visa, Goldman Sachs, Aon, American Express and Marsh & McLennan",http://www.reuters.com/article/2014/10/13/bc-analysts-review-idUSnPnbrPqb2+88+PRN20141013,
20141016 1:00PM UTC,UrgentRxÂ® Founder Honored by Goldman Sachs for Entrepreneurship,http://www.reuters.com/article/2014/10/15/co-urgentrx-idUSnBw156371a+100+BSW20141015,
20141016 12:00PM UTC,Bromium CEO Honored by Goldman Sachs for Entrepreneurship,http://www.reuters.com/article/2014/10/15/idUSnMKW7MJDza+1dc+MKW20141015,
20141016 8:00AM UTC,Goldman Sachs Honors Nexenta CEO as One of the Leading Tech Entrepreneurs,http://www.reuters.com/article/2014/10/15/ca-nexenta-idUSnBw155573a+100+BSW20141015,
20141017 5:32PM UTC,DelosÂ® Honored by Goldman Sachs for Entrepreneurship,http://www.reuters.com/article/2014/10/16/ny-delos-idUSnBw166556a+100+BSW20141016,
20141017 4:19PM UTC,Exclusive: Goldman Sachs in talks to acquire ETF provider IndexIQ - sources,http://www.reuters.com/article/2014/10/16/us-goldman-etf-m-a-idUSKCN0I52KD20141016,
20141017 3:00PM UTC,Project Frog CEO Honored by Goldman Sachs for Entrepreneurship,http://www.reuters.com/article/2014/10/16/ca-project-frog-idUSnBw166305a+100+BSW20141016,
20141017 7:40AM UTC,Goldman Sachs profit gets big boost from bond market pickup,http://www.reuters.com/article/2014/10/16/goldman-results-idUSL3N0SB4IS20141016,
20141017 7:35AM UTC,Goldman Sachs Reports Third Quarter Earnings Per Common Share of $4.57 and Increases the Quarterly Dividend to $0.60 Per Common Share,http://www.reuters.com/article/2014/10/16/ny-goldman-sachs-idUSnBw165439a+100+BSW20141016,
20141018 12:10PM UTC,Founders of VEEV SpiritsÂ® Honored by Goldman Sachs for Entrepreneurship,http://www.reuters.com/article/2014/10/17/ca-veev-spirits-idUSnBw175729a+100+BSW20141017,
20141021 8:24AM UTC,Goldman Sachs MLP and Energy Renaissance Fund Announces Acquisition of Leverage Financing,http://www.reuters.com/article/2014/10/20/ny-goldman-sachs-mlp-idUSnBw205715a+100+BSW20141020,
20141021 6:00AM UTC,Goldman Sachs Recognizes Eagle Eye Networks Founder & CEO Dean Drako as One of the '100 Most Intriguing Entrepreneurs of 2014',http://www.reuters.com/article/2014/10/20/tx-eagle-eye-idUSnBw205318a+100+BSW20141020,
20141022 2:25PM UTC,"Monument Wealth Management's David B. Armstrong, CFA, Accepts Honorable Invitation to Goldman Sachs 10,000 Small Businesses Class",http://www.reuters.com/article/2014/10/21/dc-monument-wealth-idUSnPnbYv3qZ+91+PRN20141021,
20141022 8:45AM UTC,"Quarterly Earnings Review and New Service Launch - Research Reports on Goldman Sachs, Visa, American Express, Blackstone and Fifth Third Bancorp",http://www.reuters.com/article/2014/10/21/bc-analysts-review-idUSnPnSb0LV+53+PRN20141021,
20141023 5:32PM UTC,U.S. Court hears arguments on sex discrimination at Goldman Sachs,http://www.reuters.com/article/2014/10/22/us-usa-employment-goldman-idUSKCN0IB2L620141022,
20141023 5:19PM UTC,U.S. Court hears arguments on sex discrimination at Goldman Sachs,http://www.reuters.com/article/2014/10/22/usa-employment-goldman-idUSL2N0SG2YZ20141022,
20141023 10:30AM UTC,REG-JP Morgan Chase JPMorgan Chase to Present at the Goldman Sachs U.S. Financial Services Conference,http://www.reuters.com/article/2014/10/22/j-p-morgan-chase-idUSnBw225924a+100+BSW20141022,
20141023 10:28AM UTC,JPMorgan Chase to Present at the Goldman Sachs U.S. Financial Services Conference,http://www.reuters.com/article/2014/10/22/ny-jpmorgan-chase-idUSnBw225918a+100+BSW20141022,
20141023 8:12AM UTC,New Issue- Goldman Sachs prices 1.25 bln euro 2019 FRN,http://www.reuters.com/article/2014/10/22/idUSL3N0SH4SE20141022,
20141023 8:00AM UTC,Goldman Sachs Honors iboss Network Security Founders for Entrepreneurship,http://www.reuters.com/article/2014/10/22/idUSnMKW3FLPVa+1de+MKW20141022,
20141025 3:32AM UTC,Special Report: Why Madrid's poor fear Goldman Sachs and Blackstone,http://www.reuters.com/article/2014/10/24/us-spain-housing-specialreport-idUSKCN0ID0GP20141024,
20141025 2:59AM UTC,SPECIAL REPORT-Why Madrid's poor fear Goldman Sachs and Blackstone,http://www.reuters.com/article/2014/10/24/spain-housing-idUSL3N0SJ30F20141024,
20141025 2:55AM UTC,SPECIAL REPORT-Why Madrid's poor fear Goldman Sachs and Blackstone,http://www.reuters.com/article/2014/10/24/spain-housing-idUSL3N0SH5PL20141024,
20141028 4:13PM UTC,Goldman Sachs Recognizes Eagle Eye Networks Founder & CEO Dean Drako as One of the '100 Most Intriguing Entrepreneurs of 2014',http://www.reuters.com/article/2014/10/27/tx-eagle-eye-idUSnBw205318a+100+BSW20141027,
20141029 11:38AM UTC,CORRECTED-MOVES-Goldman Sachs Germany head Dibelius steps down - memo,http://www.reuters.com/article/2014/10/28/goldman-moves-germany-idUSL5N0SN3N420141028,
20141030 2:35PM UTC,Honeywell To Present At Goldman Sachs Industrials Conference,http://www.reuters.com/article/2014/10/29/nj-honeywell-webcast-idUSnPn5z6DH7+86+PRN20141029,
20141030 5:38AM UTC,Atlantia denies mandate to Goldman Sachs on ADR stake sale,http://www.reuters.com/article/2014/10/29/us-atlantia-goldmansachs-idUSKBN0II0SV20141029,
20141030 5:36AM UTC,Atlantia denies mandate to Goldman Sachs on ADR stake sale,http://www.reuters.com/article/2014/10/29/atlantia-goldmansachs-idUSI6N0SF00I20141029,
20141031 6:02PM UTC,Regal Beloit Corporation To Present At The Goldman Sachs Industrials Conference,http://www.reuters.com/article/2014/10/30/wi-regalbeloit-conf-idUSnPn3Tt8nM+91+PRN20141030,
20141031 4:36PM UTC,Employment Litigation Firms File Collective Action Lawsuit Against Goldman Sachs Seeking Proper Overtime Pay For Hourly Workers,http://www.reuters.com/article/2014/10/30/gs-lawsuit-overtime-idUSnPn9RRSSp+9e+PRN20141030,
20141031 9:25AM UTC,Timken to Present at Goldman Sachs Industrials Investor Conference,http://www.reuters.com/article/2014/10/30/timken-goldman-confer-idUSnPn2mqQcp+84+PRN20141030,
20141031 8:30AM UTC,"Conference Participation, Dividend, Upcoming Annual Meeting, Training Program, and Promotional Event - Research Reports on Santander Brasil, Goldman Sachs, Visa, Banco Santander and American Express",http://www.reuters.com/article/2014/10/30/bc-analysts-review-idUSnPn3TS48L+99+PRN20141030,
20141101 2:09PM UTC,Norfolk Southern EVP Planning and CIO Deborah Butler to address Goldman Sachs Industrials Conference,http://www.reuters.com/article/2014/10/31/va-norfolksouthrnconf-idUSnPn8qCGYg+8e+PRN20141031,
20141101 1:21PM UTC,Stanley Black & Decker to Present at the Goldman Sachs Industrials Conference,http://www.reuters.com/article/2014/10/31/ct-stanley-black-decker-idUSnBw315800a+100+BSW20141031,
20141101 9:10AM UTC,Earnings Expert Research - Goldman Sachs Group,http://www.reuters.com/article/2014/10/31/bc-investor-edge-idUSnPn8GS837+98+PRN20141031,
20141104 5:02PM UTC,Goldman Sachs to Present at the Bank of America Merrill Lynch 2014 Banking and Financial Services Conference,http://www.reuters.com/article/2014/11/03/ny-goldman-sachs-group-idUSnBw036878a+100+BSW20141103,
20141104 4:15PM UTC,Goodyear to Present at Goldman Sachs Industrials Conference,http://www.reuters.com/article/2014/11/03/goodyearsachs-conf-idUSnPn7fWpqS+89+PRN20141103,
20141104 9:30AM UTC,"The Zacks Analyst Blog Highlights: Goldman Sachs Group, Visa, DuPont, Merck and Pfizer",http://www.reuters.com/article/2014/11/03/zacks-goldmansachs-idUSnPn5GSwrk+98+PRN20141103,
20141104 8:55AM UTC,Goldman Sachs MLP Income Opportunities Fund Announces Increased Quarterly Distribution of $0.330 Per Share,http://www.reuters.com/article/2014/11/03/ny-goldman-sachs-mlp-idUSnBw035631a+100+BSW20141103,
20141104 8:55AM UTC,Goldman Sachs MLP and Energy Renaissance Fund Announces Initial Quarterly Distribution of $0.320 Per Share,http://www.reuters.com/article/2014/11/03/ny-goldman-schs-mlp-engy-idUSnBw035627a+100+BSW20141103,
20141105 9:30AM UTC,"The Zacks Analyst Blog Highlights: Microsoft, Goldman Sachs Group, Hawaiian Holdings, STRATTEC Security and United Insurance Holdings",http://www.reuters.com/article/2014/11/04/il-zacks-investment-idUSnPn8RSWHt+9e+PRN20141104,
20141105 8:30AM UTC,"Eaton to Participate in the Goldman Sachs Industrials Conference November 12, 2014",http://www.reuters.com/article/2014/11/04/oh-eaton-idUSnBw045725a+100+BSW20141104,
20141106 4:30PM UTC,PolyOne To Present at the 2014 Goldman Sachs US Emerging / SMID Cap Growth Conference,http://www.reuters.com/article/2014/11/05/oh-polyone-conf-idUSnPn6R9fhb+90+PRN20141105,
20141106 4:15PM UTC,"United Rentals to Present at the Goldman Sachs Industrials Conference on November 12, 2014",http://www.reuters.com/article/2014/11/05/ct-united-rentals-idUSnBw056441a+100+BSW20141105,
20141106 2:58PM UTC,Mueller Water Products to Present at Baird's 2014 Industrials Conference and the Goldman Sachs Industrials Conference 2014,http://www.reuters.com/article/2014/11/05/idUSnGNX6G9JLF+1d7+GNW20141105,
20141107 6:34PM UTC,MOVES-Goldman Sachs promotes West Coast technology banker,http://www.reuters.com/article/2014/11/06/goldman-moves-idUSL1N0SW3H220141106,
20141107 5:00PM UTC,United Technologies to present at Goldman Sachs Industrials Conference,http://www.reuters.com/article/2014/11/06/unitedtechnologiescor-idUSnPn9YV860+98+PRN20141106,
20141107 3:00PM UTC,Delta to Present at Goldman Sachs Industrials Conference 2014,http://www.reuters.com/article/2014/11/06/delta-goldman-sachs-idUSnPn68QXfH+8d+PRN20141106,
20141107 12:06PM UTC,Tenneco to Webcast Presentation at Goldman Sachs Industrials Conference,http://www.reuters.com/article/2014/11/06/il-tenneco-idUSnBw066298a+100+BSW20141106,
20141107 11:15AM UTC,Northrop Grumman to Participate in 2014 Goldman Sachs Industrials Conference,http://www.reuters.com/article/2014/11/06/northrop-goldmansachs-idUSnPnf6YNL+47+PRN20141106,
20141107 11:11AM UTC,Quanta Services to Present at Baird Industrial Conference & Goldman Sachs Industrials Conference,http://www.reuters.com/article/2014/11/06/tx-quanta-services-idUSnPn9nT1PS+8b+PRN20141106,
20141107 11:00AM UTC,Sanderson Farms to Participate in Goldman Sachs U.S. Emerging/SMID Cap Growth Conference,http://www.reuters.com/article/2014/11/06/ms-sanderson-farms-idUSnBw065047a+100+BSW20141106,
20141107 9:06AM UTC,AGCO to Present at the 2014 Goldman Sachs Industrials Conference,http://www.reuters.com/article/2014/11/06/ga-agco-idUSnBw065805a+100+BSW20141106,
20141107 8:30AM UTC,Tutor Perini to Present at the Goldman Sachs Industrials Conference,http://www.reuters.com/article/2014/11/06/ca-tutor-perini-idUSnBw065282a+100+BSW20141106,
20141107 8:03AM UTC,ValueVision Media to Present at the Goldman Sachs US Emerging / SMID Cap Growth Conference,http://www.reuters.com/article/2014/11/06/idUSnMKW7Xwd2a+1d0+MKW20141106,
