20151027 1:28PM UTC,Honeywell To Present At Goldman Sachs Industrials Conference,http://www.reuters.com/article/honeywell-conf-idUSnPn79Y6N0+8a+PRN20151026,
20151027 10:18AM UTC,Goldman Sachs Veteran Joins Pax World,http://www.reuters.com/article/pax-world-hires-idUSnPn6zBY1y+8c+PRN20151026,
20151027 1:39AM UTC,Oil prices could go 'sharply lower' as product inventories near maximum capacity: Goldman Sachs,http://www.reuters.com/article/us-oil-markets-goldman-sachs-idUSKCN0SK0E820151026,
20151027 1:36AM UTC,"UPDATE 1-Oil prices could go sharply lower"" as product inventories near maximum capacity -Goldman Sachs""",http://www.reuters.com/article/oil-markets-goldman-sachs-idUSL3N12Q25620151026,
20151027 1:20AM UTC,"Oil prices could go sharply lower"" as product inventories near maximum capacity -Goldman Sachs""",http://www.reuters.com/article/oil-markets-goldman-sachs-idUSL8N12Q06L20151026,
20151028 6:00PM UTC,Synchronoss Forms New Venture to Develop Advanced Secure Mobility Solutions Leveraging Technology Contributed by Goldman Sachs,http://www.reuters.com/article/nj-goldman-sachs-idUSnBw276982a+100+BSW20151027,
20151028 5:05PM UTC,United Technologies to present at Goldman Sachs Industrials Conference,http://www.reuters.com/article/united-tech-corp-conf-idUSnPn107LQf+86+PRN20151027,
20151028 4:30PM UTC,Goodyear to Present at Goldman Sachs Industrials Conference,http://www.reuters.com/article/goodyear-goldmansachs-idUSnPn2jjLyg+84+PRN20151027,
20151028 9:00AM UTC,KCSâ€™ Michael Upchurch to Address the Goldman Sachs Industrials Conference,http://www.reuters.com/article/mo-kansas-city-southern-idUSnBw275443a+100+BSW20151027,
20151028 7:30AM UTC,Talentsoft Closes 25 Million EUR Investment Round Led By Goldman Sachs,http://www.reuters.com/article/bc-talentsoft-idUSnPn3ZQ9nG+99+PRN20151027,
20151028 6:55AM UTC,Ryder to Address Goldman Sachs Industrials Conference,http://www.reuters.com/article/fl-ryder-system-idUSnBw275191a+100+BSW20151027,
20151029 8:30PM UTC,REFILE-Goldman Sachs eases shareholder efforts to nominate directors,http://www.reuters.com/article/goldman-sachs-board-idUSL3N12S6O520151029,
20151029 4:39PM UTC,United Rentals to Present at the Goldman Sachs Industrials Conference 2015,http://www.reuters.com/article/ct-united-rentals-idUSnBw286758a+100+BSW20151028,
20151029 1:51PM UTC,MOVES-Goldman Sachs veteran Winkelried to join TPG as co-CEO,http://www.reuters.com/article/tpg-moves-winkelried-idUSL1N12S22I20151028,
20151029 10:53AM UTC,Honored by Goldman Sachs for Entrepreneurship - UrgentRx's Jordan Eisenberg among 100 Most Intriguing Entrepreneurs at 2015 Builders + Innovators Summit,http://www.reuters.com/article/urgentrx-ceo-honored-idUSnPn2MpJYF+97+PRN20151028,
20151029 10:20AM UTC,Stanley Black & Decker To Present At The Goldman Sachs Industrials Conference,http://www.reuters.com/article/stanleyblackdecker-idUSnPn5j8rFM+83+PRN20151028,
20151029 9:00AM UTC,Union Pacific Corporation CFO Rob Knight to Address Goldman Sachs Industrials Conference 2015,http://www.reuters.com/article/union-pacific-conf-idUSnPn9qLsf2+88+PRN20151028,
20151029 7:55AM UTC,Inovalon To Present At The 2015 Goldman Sachs US Emerging / Small & Mid Cap Growth Conference,http://www.reuters.com/article/idUSnGNXGd7F8+f2+GNW20151028,
20151030 5:05PM UTC,Parker Scheduled to Present at Goldman Sachs Global Industrials Conference on November 4 at 9:20 a.m. Eastern,http://www.reuters.com/article/idUSnGNX8jSXq1+1cc+GNW20151029,
20151030 4:15PM UTC,Opower to Present at the Goldman Sachs US Emerging & SMID Cap Growth Conference,http://www.reuters.com/article/va-opower-idUSnBw295942a+100+BSW20151029,
20151030 7:30AM UTC,Watsco to Present at the Goldman Sachs Industrials Conference,http://www.reuters.com/article/fl-watsco-idUSnBw295090a+100+BSW20151029,
20151030 6:30AM UTC,Ingersoll Rand to Present at Goldman Sachs Industrials Conference,http://www.reuters.com/article/nc-ingersoll-rand-idUSnBw295175a+100+BSW20151029,
20151031 5:00PM UTC,The Manitowoc Company to Present at Goldman Sachs Global Industrials Conference,http://www.reuters.com/article/wi-manitowoc-company-idUSnBw305989a+100+BSW20151030,
20151031 12:44PM UTC,Northrop Grumman to Participate in 2015 Goldman Sachs Industrials Conference,http://www.reuters.com/article/idUSnGNX2ZcFX0+1d6+GNW20151030,
20151031 11:00AM UTC,"B/E Aerospace to Present at Goldman Sachs Conference in Boston on November 3, 2015",http://www.reuters.com/article/fl-b-e-aerospace-idUSnBw305461a+100+BSW20151030,
20151031 9:00AM UTC,"Rubicon Project to Present at the RBC Capital Markets Technology, Internet, Media and Telecommunications Conference and Goldman Sachs US Emerging/SMID Cap Growth Conference",http://www.reuters.com/article/ca-rubicon-project-idUSnBw305122a+100+BSW20151030,
20151103 1:19PM UTC,"Goldman Sachs says Valeant has long road ahead, cuts rating",http://www.reuters.com/article/us-valeant-pharmacies-research-idUSKCN0SR22T20151102,
20151103 1:16PM UTC,"Goldman Sachs says Valeant has long road ahead, cuts rating",http://www.reuters.com/article/valeant-pharmacies-research-idUSL3N12X58N20151102,
20151103 10:02AM UTC,L-3 to Present at the Goldman Sachs Industrials Conference 2015,http://www.reuters.com/article/ny-l-3-communications-idUSnBw026155a+100+BSW20151102,
20151103 9:00AM UTC,Lennox International to Present at Goldman Sachs Conference,http://www.reuters.com/article/lennoxint-conference-idUSnPn2WsmtH+91+PRN20151102,
20151103 9:00AM UTC,Caterpillar to Participate in the Goldman Sachs Industrials Conference 2015 on November 4; Webcast Available,http://www.reuters.com/article/caterpillar-conf-idUSnPnLbkfG+51+PRN20151102,
20151103 6:45AM UTC,Leidos to Present at the Goldman Sachs Industrials Conference,http://www.reuters.com/article/leidos-sachs-conf-idUSnPn46WqqR+89+PRN20151102,
20151104 9:00AM UTC,iboss Cybersecurity Announces $35Â Million Investment from Goldman Sachs in Series A Funding Round,http://www.reuters.com/article/ca-iboss-cybersecurity-idUSnBw035107a+100+BSW20151103,
20151104 8:40AM UTC,Goldman Sachs MLP and Energy Renaissance Fund Announces Quarterly Distribution of $0.335 Per Share,http://www.reuters.com/article/ny-goldman-sachs-asset-idUSnBw036089a+100+BSW20151103,
20151104 8:40AM UTC,Goldman Sachs MLP Income Opportunities Fund Announces Quarterly Distribution of $0.345 Per Share,http://www.reuters.com/article/ny-goldman-sachs-idUSnBw036087a+100+BSW20151103,
20151105 9:14AM UTC,Kandi Technologies to Participate in Goldman Sachs China Conference 2015,http://www.reuters.com/article/idUSnGNX7yKm7c+1c8+GNW20151104,
20151106 9:12PM UTC,Goldman Sachs to promote junior bankers faster in bid to keep talent,http://www.reuters.com/article/us-goldman-sachs-banking-idUSKCN0SU2XW20151106,
20151106 5:07PM UTC,"Goldman Sachs BDC, Inc. Reports Third Quarter 2015 Financial Results and Announces Fourth Quarter Dividend of $0.45 Per Share",http://www.reuters.com/article/ny-goldman-sachs-idUSnBw056955a+100+BSW20151105,
20151106 4:06PM UTC,Sunrun to Present at the Goldman Sachs U.S. Emerging / SMID Cap Growth Conference,http://www.reuters.com/article/idUSnGNX7VWNtP+1dd+GNW20151105,
20151106 4:01PM UTC,UPDATE 1-Goldman Sachs to promote junior bankers faster in bid to keep talent,http://www.reuters.com/article/goldman-sachs-banking-idUSL1N13030U20151105,
20151106 3:33PM UTC,Sanderson Farms to Participate in Goldman Sachs U.S. Emerging/SMID Cap Growth Conference,http://www.reuters.com/article/ms-sanderson-farms-idUSnBw056736a+100+BSW20151105,
20151106 3:04PM UTC,Goldman Sachs to promote junior bankers faster in bid to keep talent ,http://www.reuters.com/article/us-goldman-sachs-banking-idUSKCN0SU2XW20151105,
20151106 3:00PM UTC,Goldman Sachs to promote junior bankers faster in bid to keep talent,http://www.reuters.com/article/goldman-sachs-banking-idUSL1N1302JG20151105,
20151106 9:05AM UTC,Enphase Energy to Participate at the Goldman Sachs U.S. Emerging/SMID Cap Growth Conference,http://www.reuters.com/article/ca-enphase-energy-inc-idUSnBw055476a+100+BSW20151105,
20151106 8:23AM UTC,"Goldman Sachs BDC, Inc. Favorably Amends Its Revolving Credit Facility",http://www.reuters.com/article/ny-goldman-sachs-bdc-idUSnBw055883a+100+BSW20151105,
20151106 8:00AM UTC,"Freshpet, Inc. to Participate in the Goldman Sachs' 3rd Annual US Emerging & SMID Cap Growth Conference",http://www.reuters.com/article/idUSnGNXbbv89K+1c1+GNW20151105,
20151107 3:37PM UTC,Valeant says Goldman Sachs sold 1.3 million shares backing loan to CEO,http://www.reuters.com/article/us-valeant-pharmacies-idUSKCN0SV1SB20151106,
20151107 8:29AM UTC,Valeant says Goldman Sachs sold 1.3 million shares backing loan to CEO,http://www.reuters.com/article/valeant-pharmacies-idUSL1N1310Y620151106,
20151110 9:38AM UTC,MOVES-EM banker Turner to leave Goldman Sachs,http://www.reuters.com/article/moves-turner-goldman-sachs-idUSL8N1343GL20151109,
20151110 9:00AM UTC,Criteo to Present at the Goldman Sachs US Emerging / SMID Cap Growth Conference,http://www.reuters.com/article/criteo-presentation-idUSnPn7N9yv4+90+PRN20151109,
20151110 8:30AM UTC,"Amplify Snack Brands, Inc. to Present at Goldman Sachs US Emerging/SMID Cap Growth Conference",http://www.reuters.com/article/tx-amplify-snack-brands-idUSnBw095244a+100+BSW20151109,
20151111 4:35PM UTC,PolyOne To Present at the Goldman Sachs US Emerging/SMID Cap Growth Conference,http://www.reuters.com/article/polyone-goldman-conf-idUSnPn8hpsqB+81+PRN20151110,
20151111 4:30PM UTC,Cott to Present at the Goldman Sachs 2015 US Emerging/SMID Cap Growth Conference and the Bank of America Merrill Lynch 2015 Leveraged Finance Conference,http://www.reuters.com/article/idUSnMKWClGV9a+1ec+MKW20151110,
20151111 4:05PM UTC,Universal Display Corporation to Present at the Goldman Sachs US Emerging/SMID Cap Growth Conference,http://www.reuters.com/article/nj-universal-display-idUSnBw106905a+100+BSW20151110,
20151111 8:26AM UTC,Goldman Sachs Asset Management Launches ActiveBetaÂ® International Equity Exchange-Traded Fund,http://www.reuters.com/article/ny-goldman-sachs-asset-idUSnBw105992a+100+BSW20151110,
20151112 4:05PM UTC,Aerohive to Present at the Goldman Sachs US Emerging/SMID Cap Growth Conference on November 19,http://www.reuters.com/article/ca-aerohive-networks-idUSnBw115477a+100+BSW20151111,
20151112 7:00AM UTC,Radius Health to Present at the Goldman Sachs U.S. Emerging/SMID Cap Growth Conference,http://www.reuters.com/article/idUSnGNX8VDJX9+1de+GNW20151111,
20151112 3:06AM UTC,Canadian Solar to Attend Goldman Sachs China Conference in Shanghai,http://www.reuters.com/article/canadian-solar-trade-idUSnPnf8LGN+47+PRN20151111,
20151113 5:40PM UTC,"ServiceMaster Global Holdings, Inc. to Participate in Goldman Sachs 2015 US Emerging/SMID Cap Growth Conference",http://www.reuters.com/article/tn-servicemaster-idUSnBw126703a+100+BSW20151112,
20151113 5:20PM UTC,Shutterstock To Present at the 2015 Goldman Sachs US Emerging/SMID Cap Growth Conference,http://www.reuters.com/article/ny-shutterstock-conf-idUSnPnDjF9r+54+PRN20151112,
20151113 4:15PM UTC,Cvent to Present at Goldman Sachs U.S. Emerging/SMID Cap Growth Conference,http://www.reuters.com/article/va-cvent-idUSnBw126209a+100+BSW20151112,
20151113 4:05PM UTC,comScore to Present at Goldman Sachs US Emerging / SMID Cap Growth Conference,http://www.reuters.com/article/comscore-conference-idUSnPnb1SG7l+8c+PRN20151112,
20151113 4:00PM UTC,Amicus Therapeutics to Present at Goldman Sachs US Emerging / SMID Cap Growth Conference,http://www.reuters.com/article/idUSnGNX98S80J+1c9+GNW20151112,
20151113 3:04PM UTC,Goldman Sachs names 425 managing directors in new class ,http://www.reuters.com/article/us-goldman-sachs-banking-idUSKCN0T12HY20151112,
20151113 2:54PM UTC,Moelis & Company Management to Speak at the Goldman Sachs US Emerging/SMID Cap Growth Conference,http://www.reuters.com/article/ny-moelis-company-idUSnBw126486a+100+BSW20151112,
20151113 2:53PM UTC,Goldman Sachs names 425 managing directors in new class,http://www.reuters.com/article/goldman-sachs-banking-idUSL1N1361WM20151112,
20151113 11:00AM UTC,Interval Leisure Group to Participate in the Goldman Sachs US Emerging/SMID Cap Growth Conference,http://www.reuters.com/article/fl-interval-leisure-grp-idUSnBw125874a+100+BSW20151112,
20151113 10:00AM UTC,TriMas Corporation to Present at the Goldman Sachs U.S. Emerging/SMID Cap Growth Conference,http://www.reuters.com/article/mi-trimas-corporation-idUSnBw125015a+100+BSW20151112,
20151113 8:30AM UTC,2U CEO and Co-Founder Chip Paucek to Present at the Goldman Sachs US Emerging / SMID Cap Growth Conference,http://www.reuters.com/article/idUSnGNX7yl5bq+1c0+GNW20151112,
20151113 8:00AM UTC,Sequential Brands Group to Participate in Goldman Sachs Conference,http://www.reuters.com/article/idUSnGNX5l27Pl+1c2+GNW20151112,
20151113 6:30AM UTC,Foundation Medicine to Present at the Goldman Sachs SMID Cap Growth Conference,http://www.reuters.com/article/ma-foundation-medicine-idUSnBw125145a+100+BSW20151112,
20151114 5:35PM UTC,Brookdale to Present at the Goldman Sachs Emerging/SMID Cap Growth Conference on November 19,http://www.reuters.com/article/brookdale-sr-living-idUSnPn77rvB9+82+PRN20151113,
20151117 5:30PM UTC,Green Plains to Present at Goldman Sachs US Emerging / SMID Cap Growth Conference,http://www.reuters.com/article/idUSnGNX992VMS+1c7+GNW20151116,
20151117 4:31PM UTC,"REG-VWR to Present at the Goldman Sachs SMID Cap Growth Conference on November 19, 2015",http://www.reuters.com/article/idUSnHUGbhLsfj+1c8+ONE20151116,
20151117 4:01PM UTC,Greenhill Management To Speak At Investor Conference Hosted By Goldman Sachs,http://www.reuters.com/article/greenhill-invest-conf-idUSnPn6Vknt9+90+PRN20151116,
20151117 11:46AM UTC,"Blackstone to sell GCA Services to Thomas Lee, Goldman Sachs",http://www.reuters.com/article/us-gcaservices-m-a-goldmanthomaslee-idUSKCN0T51ZW20151116,
20151117 11:43AM UTC,"REFILE-Blackstone to sell GCA Services to Thomas Lee, Goldman Sachs",http://www.reuters.com/article/gcaservices-ma-goldmanthomaslee-urgentco-idUSL3N13B4YX20151116,
20151117 11:30AM UTC,Blackstone to Sell GCA Services Group to Thomas H. Lee Partners and Goldman Sachs,http://www.reuters.com/article/ny-blackstone-idUSnBw166076a+100+BSW20151116,
20151117 11:30AM UTC,Thomas H. Lee Partners and Goldman Sachs to Acquire GCA Services Group,http://www.reuters.com/article/oh-thomas-h-lee-idUSnBw166063a+100+BSW20151116,
20151117 10:24AM UTC,KeyCorp To Present At The Goldman Sachs U.S. Financial Services Conference,http://www.reuters.com/article/keycorp-conference-idUSnPnBLvYT+5b+PRN20151116,
20151118 6:00PM UTC,Delek US Holdings to Participate in the 2015 Goldman Sachs SMID Cap Growth Conference,http://www.reuters.com/article/tn-delek-us-holdings-idUSnBw176743a+100+BSW20151117,
20151119 11:15AM UTC,"SureID, Inc. Secures Capital Raise with Goldman Sachs Specialty Lending Group L.P.",http://www.reuters.com/article/or-sureid-inc-idUSnBw186222a+100+BSW20151118,
20151119 8:00AM UTC,SunPower Corporation CFO Chuck Boynton to Speak at Goldman Sachs U.S. Emerging / SMID Cap Growth Conference in New York City,http://www.reuters.com/article/sunpower-smid-conf-idUSnPnbrPWtP+8d+PRN20151118,
20151119 6:00AM UTC,Applied Merchant Systems Completes Strategic Acquisition and Financing from Goldman Sachs Specialty Lending Group and Business Development Corporation of America,http://www.reuters.com/article/ca-applied-merchant-sys-idUSnBw185419a+100+BSW20151118,
20151121 2:53PM UTC,SunTrust to Present at the Goldman Sachs U.S. Financial Services Conference,http://www.reuters.com/article/suntrust-conference-idUSnPn5FfnJd+92+PRN20151120,
20151124 6:03PM UTC,"State Streetâ€™s Chief Executive Officer of Europe, the Middle East and Africa (EMEA), Jeff Conway, to Present at the 2015 Goldman Sachs US Financial Services Conference",http://www.reuters.com/article/ma-state-street-corp-idUSnBw236346a+100+BSW20151123,
20151124 2:30PM UTC,McGraw Hill Financial to Present at the Goldman Sachs U.S. Financial Services Conference on December 9,http://www.reuters.com/article/mcgraw-hill-financial-idUSnPn9HR9gn+98+PRN20151123,
20151124 12:03PM UTC,Blackstone to Present at the Goldman Sachs US Financial Services Conference,http://www.reuters.com/article/ny-blackstone-idUSnBw235978a+100+BSW20151123,
20151124 9:00AM UTC,Ally Financial to present at the Goldman Sachs U.S. Financial Services Conference,http://www.reuters.com/article/ally-financial-conf-idUSnPn3lVvcq+88+PRN20151123,
20151125 3:45PM UTC,Wells Fargo to Present at the Goldman Sachs US Financial Services Conference 2015,http://www.reuters.com/article/ca-wells-fargo-idUSnBw246213a+100+BSW20151124,
20151125 11:02AM UTC,Discover Financial Services to Present at Goldman Sachs US Financial Services Conference,http://www.reuters.com/article/il-discover-financial-idUSnBw245823a+100+BSW20151124,
20151125 9:00AM UTC,First Republic Bank To Present At The Goldman Sachs U.S. Financial Services Conference,http://www.reuters.com/article/first-republic-bank-idUSnPn4pZsPh+8a+PRN20151124,
20151125 8:00AM UTC,Stillwater Mining Company to Participate in the Goldman Sachs Global Metals and Mining Conference,http://www.reuters.com/article/idUSnGNX49LVGP+1cf+GNW20151124,
20151125 8:00AM UTC,Janus Capital Group Inc. Executives to Present at Goldman Sachs 2015 U.S. Financial Services Conference,http://www.reuters.com/article/co-janus-capital-group-idUSnBw245110a+100+BSW20151124,
20151126 12:37PM UTC,Uber raids Goldman Sachs for talent,http://www.reuters.com/news/video/videoStory?storyID=113814457,
20151201 5:00PM UTC,Synchrony Financial to Participate in the Goldman Sachs US Financial Services Conference 2015,http://www.reuters.com/article/ct-synchrony-financial-idUSnBw306272a+100+BSW20151130,
20151201 2:00PM UTC,BlackRockâ€™s Robert S. Kapito to Present at the Goldman Sachs 2015 US Financial Services Conference on December 8th,http://www.reuters.com/article/ny-blackrock-idUSnBw306040a+100+BSW20151130,
20151201 10:30AM UTC,Ameriprise Financial Chairman and Chief Executive Officer to Present at the Goldman Sachs US Financial Services Conference,http://www.reuters.com/article/mn-ameriprise-financial-idUSnBw305785a+100+BSW20151130,
20151201 9:00AM UTC,Navient CEO and CFO to present at Goldman Sachs U.S. Financial Services Conference on Dec. 8,http://www.reuters.com/article/idUSnGNX9W35Nz+1d2+GNW20151130,
20151202 4:30PM UTC,Sallie Mae Chairman and CEO To Present at Goldman Sachs U.S. Financial Services Conference on Dec. 8,http://www.reuters.com/article/de-sallie-mae-idUSnBw016362a+100+BSW20151201,
20151202 4:05PM UTC,"Oaktree to Present at the Goldman Sachs Financial Services Conference on December 8, 2015",http://www.reuters.com/article/ca-oaktree-capital-group-idUSnBw016665a+100+BSW20151201,
20151202 4:00PM UTC,Fifth Third Bancorp to Present at the 2015 Goldman Sachs U.S. Financial Services Conference,http://www.reuters.com/article/oh-fifth-third-bancorp-idUSnBw016642a+100+BSW20151201,
20151202 3:38PM UTC,BB&T; Corporation CEO to speak at Goldman Sachs U.S. Financial Services Conference,http://www.reuters.com/article/bbt-conference-idUSnPn33Rg53+88+PRN20151201,
20151202 12:16PM UTC,"Peter S. Kraus, Chairman and CEO, to Participate in the Goldman Sachs US Financial Services Conference 2015 on December 8",http://www.reuters.com/article/alliancebernstein-idUSnPn6qbDhH+85+PRN20151201,
20151202 12:00PM UTC,Och-Ziff Capital Management Group LLC to Present at the Goldman Sachs U.S. Financial Services Conference,http://www.reuters.com/article/idUSnCCN5kPVjz+1cc+MKW20151201,
20151202 12:00PM UTC,Och-Ziff Capital Management Group LLC to Present at the Goldman Sachs U.S. Financial Services Conference,http://www.reuters.com/article/idUSnMKWVcBtYa+1ea+MKW20151201,
20151202 5:00AM UTC,Signature Bank to Participate in the Goldman Sachs US Financial Services Conference 2015,http://www.reuters.com/article/ny-signature-bank-idUSnBw015076a+100+BSW20151201,
20151203 4:53PM UTC,LPL Financial to Present at the Goldman Sachs US Financial Services Conference 2015,http://www.reuters.com/article/idUSnGNX2NdhvH+1d1+GNW20151202,
20151203 4:41PM UTC,Zions Bancorporation To Present At The Goldman Sachs US Financial Services Conference 2015,http://www.reuters.com/article/zions-bancorporation-idUSnPn2T6nCT+93+PRN20151202,
20151203 4:30PM UTC,"Evercore President and Chief Executive Officer, Ralph L. Schlosstein, to Present at the Goldman Sachs 2015 US Financial Services Conference",http://www.reuters.com/article/evercore-ceo-conf-idUSnPn6ZzlM+49+PRN20151202,
20151203 4:00PM UTC,U.S. Bancorp to Speak at the Goldman Sachs US Financial Services Conference 2015,http://www.reuters.com/article/mn-us-bancorp-idUSnBw026255a+100+BSW20151202,
20151203 11:00AM UTC,Allstate to Present at Goldman Sachs U.S. Financial Services Conference 2015,http://www.reuters.com/article/allstate-goldmansachs-idUSnPnbbdl7g+80+PRN20151202,
20151203 11:00AM UTC,Lincoln Financial Group to Participate in the Goldman Sachs U.S. Financial Services Conference,http://www.reuters.com/article/pa-lincoln-financial-idUSnBw025010a+100+BSW20151202,
20151203 10:30AM UTC,Bank of America to Participate in the Goldman Sachs U.S. Financial Services Conference on December 9,http://www.reuters.com/article/nc-bank-of-america-idUSnBw025018a+100+BSW20151202,
20151203 9:00AM UTC,Regions Financial Scheduled to Participate in the Goldman Sachs U.S. Financial Services Conference,http://www.reuters.com/article/al-regions-financial-idUSnBw025059a+100+BSW20151202,
20151203 8:57AM UTC,Aflac Incorporated to Present at the Goldman Sachs U.S. Financial Services Conference 2015,http://www.reuters.com/article/aflac-goldman-conf-idUSnPn5MWvyk+98+PRN20151202,
20151203 8:30AM UTC,TD Ameritrade CEO to Speak at the Goldman Sachs US Financial Services Conference 2015,http://www.reuters.com/article/ne-td-ameritrade-idUSnBw025109a+100+BSW20151202,
20151203 8:00AM UTC,Goldman Sachs Invests US$20 Million in Ascletis,http://www.reuters.com/article/ascletis-gold-sachs-idUSnPnbhh9Lc+82+PRN20151202,
20151203 8:00AM UTC,Comerica to Present at the Goldman Sachs U.S. Financial Services Conference 2015,http://www.reuters.com/article/comerica-presentconf-idUSnPn35yGlx+84+PRN20151202,
20151203 7:45AM UTC,BNY Mellon to Present at the 2015 Goldman Sachs U.S. Financial Services Conference on December 9,http://www.reuters.com/article/bny-mellon-conference-idUSnPn9gs4rP+81+PRN20151202,
20151204 4:15PM UTC,Citigroup CFO John Gerspach to Present at the Goldman Sachs 2015 US Financial Services Conference,http://www.reuters.com/article/ny-citigroup-idUSnBw035931a+100+BSW20151203,
20151204 1:58PM UTC,Former Goldman Sachs Executive Joins Herio Capital as Chief Financial Officer,http://www.reuters.com/article/herio-capital-new-cfo-idUSnPn6dSNk5+8c+PRN20151203,
20151204 10:36AM UTC,The Hartford To Participate In The Goldman Sachs Financial Services Conference On Dec. 9,http://www.reuters.com/article/ct-the-hartford-idUSnBw035837a+100+BSW20151203,
20151204 9:09AM UTC,MGIC to Participate at the Goldman Sachs US Financial Services Conference 2015,http://www.reuters.com/article/mgic-investment-corpo-idUSnPn4xF6ZW+8b+PRN20151203,
20151204 9:09AM UTC,Citizens Financial Group to Present at Goldman Sachs U.S. Financial Services Conference 2015,http://www.reuters.com/article/ri-citizens-financial-idUSnBw035713a+100+BSW20151203,
20151204 6:30AM UTC,Radian CEO to Present at the Goldman Sachs Financial Services Conference,http://www.reuters.com/article/pa-radian-group-idUSnBw035084a+100+BSW20151203,
20151205 4:10PM UTC,First Horizon National Corp. to Participate in 2015 Goldman Sachs U.S. Financial Services Conference on Dec. 8,http://www.reuters.com/article/idUSnGNX6dL7qP+1c9+GNW20151204,
20151205 3:49PM UTC,CME Group Chief Financial Officer to Present at Goldman Sachs Conference,http://www.reuters.com/article/cme-group-idUSnPn3gvGl3+84+PRN20151204,
20151205 2:03PM UTC,Goldman Sachs reiterates 'lower for even longer' view on oil,http://www.reuters.com/article/us-goldman-oil-outlook-idUSKBN0TN2AE20151204,
20151205 8:30AM UTC,Voya Financial to Present at 2015 Goldman Sachs U.S. Financial Services Conference,http://www.reuters.com/article/ny-voya-conference-idUSnPn9Fjr7H+91+PRN20151204,
20151205 8:30AM UTC,CIT To Present at the Goldman Sachs U.S. Financial Services Conference on December 9,http://www.reuters.com/article/ny-cit-group-idUSnBw045095a+100+BSW20151204,
20151205 8:00AM UTC,"CBRE Group, Inc. to Present at Goldman Sachs U.S. Financial Services Conference",http://www.reuters.com/article/ca-cbre-group-inc-idUSnBw045002a+100+BSW20151204,
20151209 5:08PM UTC,Fitch Affirms Goldman Sachs' Ratings at 'A/F1',http://www.reuters.com/article/ny-fitch-ratings-goldman-idUSnBw086719a+100+BSW20151208,
20151209 4:46PM UTC,Fitch Affirms Goldman Sachs' Ratings at 'A/F1',http://www.reuters.com/article/idUSFit94320720151208,
20151209 8:00AM UTC,Vitals Secures $41 Million from Goldman Sachs and Existing Investors,http://www.reuters.com/article/nj-vitals-idUSnBw085158a+100+BSW20151208,
20151210 6:00AM UTC,"Data Vendors Sign-up to Provide Data to Recently Announced Goldman Sachs, JPMorgan Chase, Morgan Stanley and SmartStream Backed Reference Data Utility",http://www.reuters.com/article/smartstream-idUSnBw095074a+100+BSW20151209,
20151211 9:00AM UTC,Former Goldman Sachs Partner Leads Nearly $3 Million Investment in Wearable Tech Company,http://www.reuters.com/article/wearsafe-labs-idUSnPn8ZT9Sp+9a+PRN20151210,
20151216 4:15PM UTC,Baxalta to Present at Goldman Sachs Healthcare CEOs Unscripted Conference,http://www.reuters.com/article/il-baxalta-incorporated-idUSnBw156628a+100+BSW20151215,
