20140102 4:05PM UTC,Alon USA To Participate in the Goldman Sachs Global Energy Conference 2014 and The Deutsche Bank US Independent Refiners One-On-One Conference,http://www.reuters.com/article/2014/01/02/alon-usa-energy-idUSnPnDAgHbzS+169+PRN20140102,
20140102 4:01PM UTC,Biogen Idec to Present at the Goldman Sachs Healthcare CEOs Unscripted Conference,http://www.reuters.com/article/2014/01/02/ma-biogen-idec-idUSnBw025908a+100+BSW20140102,
20140102 12:00PM UTC,Oceaneering to Participate at Goldman Sachs Global Energy Conference 2014,http://www.reuters.com/article/2014/01/02/tx-oceaneering-mcevoy-idUSnPnDAfRnr4+168+PRN20140102,
20140102 11:48AM UTC,Mylan to Present at the Goldman Sachs Healthcare CEOs Unscripted: A View from the Top Conference,http://www.reuters.com/article/2014/01/02/mylan-ceos-conference-idUSnPnNEgDnq4+168+PRN20140102,
20140103 2:30PM UTC,Bristol-Myers Squibb to Take Part in Goldman Sachs Healthcare CEOs Unscripted Conference,http://www.reuters.com/article/2014/01/03/ny-bristol-myers-squibb-idUSnBw035536a+100+BSW20140103,
20140106 4:58PM UTC,Pioneer Natural Resources To Participate In The Goldman Sachs Global Energy Conference,http://www.reuters.com/article/2014/01/06/tx-pioneer-natural-res-idUSnBw066848a+100+BSW20140106,
20140106 3:28PM UTC,"Cobalt International Energy, Inc. to Participate in Goldman Sachs 2014 Global Energy Conference",http://www.reuters.com/article/2014/01/06/tx-cobalt-international-idUSnBw066677a+100+BSW20140106,
20140106 6:29AM UTC,Deutsche Bank hires Goldman Sachs's Malaysia head: sources,http://www.reuters.com/article/2014/01/06/us-deutsche-malaysia-idUSBREA050CE20140106,
20140106 6:28AM UTC,UPDATE 1-Deutsche Bank hires Goldman Sachs's Malaysia head -sources,http://www.reuters.com/article/2014/01/06/deutsche-malaysia-idUSL3N0KG2OS20140106,
20140106 6:16AM UTC,REFILE-Deutsche Bank hires Goldman Sachs's Malaysia head -sources,http://www.reuters.com/article/2014/01/06/deutsche-malaysia-idUSL3N0KG2I120140106,
20140107 6:31PM UTC,"Goldman Sachs promotes investment bankers in U.S., Asia: memos",http://www.reuters.com/article/2014/01/07/us-goldman-promotions-idUSBREA061CT20140107,
20140107 6:24PM UTC,"Goldman Sachs promotes investment bankers in U.S., Asia-memos",http://www.reuters.com/article/2014/01/07/goldman-promotions-idUSL2N0KH2BV20140107,
20140107 4:00PM UTC,Enterprise Products Partners to Participate in Goldman Sachs Global Energy Conference,http://www.reuters.com/article/2014/01/07/tx-enterprise-products-idUSnBw076404a+100+BSW20140107,
20140107 8:00AM UTC,"Stock Movements, Appointments, Definitive Agreements, and New Affiliations - Research Report on Goldman Sachs, Morgan Stanley, LPL Financial, TD Ameritrade, and FXCMl",http://www.reuters.com/article/2014/01/07/bc-analysts-corner-idUSnPn7zpdhn+80+PRN20140107,
20140108 7:00AM UTC,Magnum Hunter Resources Chairman and CEO to Present at the Goldman Sachs Global Energy Conference,http://www.reuters.com/article/2014/01/08/idUSnCCN4GZNyY+1dd+MKW20140108,
20140108 7:00AM UTC,Magnum Hunter Resources Chairman and CEO to Present at the Goldman Sachs Global Energy Conference,http://www.reuters.com/article/2014/01/08/idUSnMKW0GZk7a+1d8+MKW20140108,
20140109 6:19PM UTC,Exclusive: Goldman Sachs miner halts coal exports from Colombia,http://www.reuters.com/article/2014/01/09/us-colombia-coal-cnr-exclusive-idUSBREA081CO20140109,
20140109 4:00PM UTC,Exclusive: Goldman Sachs miner halts coal exports from Colombia,http://www.reuters.com/article/2014/01/09/us-colombia-coal-cnr-exclusive-idUSBREA081CL20140109,
20140109 2:28PM UTC,Goldman Sachs coal miner halts exports due to new Colombian law,http://www.reuters.com/article/2014/01/09/colombia-coal-cnr-idUSL2N0KJ1XV20140109,
20140110 4:30PM UTC,Goldman Sachs Declares Preferred Stock Dividends,http://www.reuters.com/article/2014/01/10/ny-goldman-sachs-group-idUSnBw105720a+100+BSW20140110,
20140113 9:30AM UTC,"J.P. Morgan, Wells Fargo, Bank of America, Goldman Sachs and Morgan Stanley are part of Zacks Earnings Preview:",http://www.reuters.com/article/2014/01/13/zacks-earnings-idUSnPnCGjDdkT+169+PRN20140113,
20140113 8:01AM UTC,"Equity Summary Report: Visa, Goldman Sachs Group, New York Community Bancorp, and Cowen Group",http://www.reuters.com/article/2014/01/13/bc-aaa-idUSnPn84vVhn+84+PRN20140113,
20140114 7:00AM UTC,uTest Closes $43 Million Series E Round Led by Goldman Sachs,http://www.reuters.com/article/2014/01/14/idUSnCCN2Xp4YQ+1d3+MKW20140114,
20140114 7:00AM UTC,uTest Closes $43 Million Series E Round Led by Goldman Sachs,http://www.reuters.com/article/2014/01/14/idUSnMKWMPjJra+1f4+MKW20140114,
20140116 12:39PM UTC,Goldman Sachs fourth-quarter profit hit by lower bond trading revenue,http://www.reuters.com/article/2014/01/16/us-goldmansachs-results-idUSBREA0F0RS20140116,
20140116 12:04PM UTC,UPDATE 4-Goldman Sachs Q4 profit hit by lower bond trading revenue,http://www.reuters.com/article/2014/01/16/goldmansachs-results-idUSL2N0KQ17D20140116,
20140116 10:57AM UTC,CORRECTED-UPDATE 3-Goldman Sachs profit hit by lower bond trading revenue,http://www.reuters.com/article/2014/01/16/goldmansachs-results-idUSL3N0KQ3QE20140116,
20140116 7:39AM UTC,Goldman Sachs profit hit by lower bond trading revenue,http://www.reuters.com/article/2014/01/16/goldmansachs-results-idUSL3N0KQ2ZZ20140116,
20140116 7:35AM UTC,Goldman Sachs Reports Earnings Per Common Share of $15.46 for 2013,http://www.reuters.com/article/2014/01/16/ny-goldman-sachs-idUSnBw165701a+100+BSW20140116,
20140122 1:21PM UTC,Goldman Sachs to place 5 percent of Spain's Almirall,http://www.reuters.com/article/2014/01/22/spain-almirall-idUSE8N0HJ02320140122,
20140122 12:09PM UTC,Goldman Sachs to place up to 15.2 mln LEG Immobilien shares,http://www.reuters.com/article/2014/01/22/legimmo-placement-idUSWEB00H2D20140122,
20140122 10:14AM UTC,New Issue- Goldman Sachs prices 750 mln stg 2026 bond,http://www.reuters.com/article/2014/01/22/idUSL3N0KW4JB20140122,
20140123 4:23AM UTC,Goldman Sachs places 5 pct of Spain's Almirall at 11.75 eur/share,http://www.reuters.com/article/2014/01/23/almirall-idUSE8N0FI02I20140123,
20140124 8:25AM UTC,BRIEF-Goldman Sachs CEO 'still optimisitic' about economy -CNBC,http://www.reuters.com/article/2014/01/24/goldmansachs-brief-idUSWEN00CA620140124,
20140126 10:41PM UTC,INDIA PRESS-Goldman Sachs may buy 26 pct of Opto Circuits-PTI in Business Standard,http://www.reuters.com/article/2014/01/27/india-press-optocircuits-idUSL3N0L11DH20140127,
20140127 8:00AM UTC,CardLinx CEO and Board Members to Present at Goldman Sachs Technology Conference,http://www.reuters.com/article/2014/01/27/ca-cardlinx-association-idUSnBw275745a+100+BSW20140127,
20140128 4:01PM UTC,Criteo to Participate in the Goldman Sachs Technology & Internet Conference,http://www.reuters.com/article/2014/01/28/idUSnGNX7p1GL8+1c6+GNW20140128,
20140128 9:00AM UTC,SYNNEX Corporation to Participate in Stifel and Goldman Sachs Conferences,http://www.reuters.com/article/2014/01/28/ca-synnex-idUSnBw285714a+100+BSW20140128,
20140128 7:00AM UTC,TE Connectivity To Participate In Upcoming Conferences: Goldman Sachs Technology and Internet Conference and Stifel Technology Internet and Media Conference,http://www.reuters.com/article/2014/01/28/te-connectivity-confs-idUSnPnPHmSWfs+16c+PRN20140128,
20140129 9:00AM UTC,MACOM to Participate at the Goldman Sachs Technology and Internet Conference on February 12,http://www.reuters.com/article/2014/01/29/idUSnGNX1dRZzX+1cd+GNW20140129,
20140129 9:00AM UTC,Lexmark to participate in Goldman Sachs Technology and Internet Conference 2014,http://www.reuters.com/article/2014/01/29/lexmark-goldman-conf-idUSnPnCLlQnkj+168+PRN20140129,
20140130 4:30PM UTC,comScore to Present at the Goldman Sachs Technology and Internet Conference 2014,http://www.reuters.com/article/2014/01/30/comscoreattechconf-idUSnPnCGnPQBl+16e+PRN20140130,
20140130 4:30PM UTC,AMD to Present at Goldman Sachs Technology & Internet Conference 2014,http://www.reuters.com/article/2014/01/30/idUSnMKW7ytQHa+1c6+MKW20140130,
20140130 4:00PM UTC,"Expedia, Inc. to Participate in the Goldman Sachs Technology and Internet Conference 2014",http://www.reuters.com/article/2014/01/30/wa-expe-goldman-sachs-idUSnPnSFnKvzM+169+PRN20140130,
20140130 11:25AM UTC,Libya sues Goldman Sachs over losing trades,http://www.reuters.com/article/2014/01/30/goldmansachs-libya-idUSL5N0L43KE20140130,
20140131 4:05PM UTC,LifeLock to Present at the Goldman Sachs Technology and Internet Conference,http://www.reuters.com/article/2014/01/31/az-lifelock-idUSnBw315583a+100+BSW20140131,
20140203 9:00AM UTC,NetSuite CEO Zach Nelson To Present At Goldman Sachs Technology And Internet Conference 2014,http://www.reuters.com/article/2014/02/03/ca-netsuite-ceo-idUSnPnSFp6Lkj+164+PRN20140203,
20140204 6:24PM UTC,Google to Present at the Goldman Sachs Technology and Internet Conference,http://www.reuters.com/article/2014/02/04/ca-google-idUSnBw046897a+100+BSW20140204,
20140204 4:34PM UTC,The USHCC Applauds Goldman Sachs on Dina Powell Appointment to Lead Firm's Urban Investment Group,http://www.reuters.com/article/2014/02/04/idUSnGNX2lPHRW+1cf+GNW20140204,
20140204 4:06PM UTC,Benefitfocus to Present at the Goldman Sachs Technology and Internet Conference,http://www.reuters.com/article/2014/02/04/idUSnGNXtzQSg+e6+GNW20140204,
20140204 4:05PM UTC,Facebook to Participate in the Goldman Sachs Technology and Internet Conference,http://www.reuters.com/article/2014/02/04/ca-fb-goldman-sachs-idUSnPnSFpJqzS+169+PRN20140204,
20140204 12:00PM UTC,Yahoo to Participate at the Goldman Sachs Technology and Internet Conference,http://www.reuters.com/article/2014/02/04/ca-yahoo-idUSnBw045743a+100+BSW20140204,
20140204 7:00AM UTC,"Microsemi to Present at Stifel Technology, Internet & Media Conference and Goldman Sachs Technology & Internet Conference",http://www.reuters.com/article/2014/02/04/microsemi-trade-shows-idUSnPnLAptDfs+164+PRN20140204,
20140204 6:30AM UTC,Rocket Fuel to Present at Goldman Sachs Technology and Internet Conference,http://www.reuters.com/article/2014/02/04/idUSnGNX3QrQwq+1d4+GNW20140204,
20140204 12:01AM UTC,Spiceworks raises $57 million led by Goldman Sachs,http://www.reuters.com/article/2014/02/04/spiceworks-idUSL2N0L81CG20140204,
20140206 5:15PM UTC,Yelp to Present at Goldman Sachs Technology and Internet Conference,http://www.reuters.com/article/2014/02/06/ca-yelptechnet-conf-idUSnPnSFqvPCZ+167+PRN20140206,
20140206 5:05PM UTC,"Avnet, Inc. to Present at the 2014 Stifel Technology, Internet, and Media Conference and the Goldman Sachs Technology and Internet Conference",http://www.reuters.com/article/2014/02/06/az-avnet-idUSnBw066610a+100+BSW20140206,
20140206 8:00AM UTC,Applied Materials to Present at Goldman Sachs Technology and Internet Conference 2014,http://www.reuters.com/article/2014/02/06/idUSnHUGdvzD+71+ONE20140206,
20140206 8:00AM UTC,Cornerstone OnDemand to Present at Goldman Sachs Technology and Internet Conference,http://www.reuters.com/article/2014/02/06/ca-cornerstone-ondemand-idUSnBw065348a+100+BSW20140206,
20140206 6:55AM UTC,Shares in Tod's rise on Goldman Sachs upgrade,http://www.reuters.com/article/2014/02/06/us-tods-shares-idUSBREA150R720140206,
20140206 6:53AM UTC,UPDATE 1-Shares in Tod's rise on Goldman Sachs upgrade,http://www.reuters.com/article/2014/02/06/tods-shares-idUSL5N0LB2AD20140206,
20140206 6:30AM UTC,Akamai Technologies to Participate in the Goldman Sachs Technology and Internet Conference,http://www.reuters.com/article/2014/02/06/akamaigoldmantechcon-idUSnPnNEqd5d6+160+PRN20140206,
20140207 8:00AM UTC,TIBCO Software to Present at Goldman Sachs Technology and Internet Conference 2014,http://www.reuters.com/article/2014/02/07/idUSnMKW7KfQfa+1d4+MKW20140207,
20140207 8:00AM UTC,RingCentral to Present at the Goldman Sachs Technology and Internet Conference,http://www.reuters.com/article/2014/02/07/ca-ringcentral-idUSnBw075049a+100+BSW20140207,
20140210 4:06PM UTC,Ruckus Wireless to Present at the Goldman Sachs Technology and Internet Conference 2014,http://www.reuters.com/article/2014/02/10/ruckuswirelesspresent-idUSnPnSFr26zT+161+PRN20140210,
20140210 4:05PM UTC,Pandora Chairman and CEO to Present at the Goldman Sachs Technology and Internet Conference 2014,http://www.reuters.com/article/2014/02/10/ca-pandora-idUSnBw106360a+100+BSW20140210,
20140210 3:54PM UTC,"MOVES-Goldman Sachs, BNY Mellon, Morgan Stanley, Sberbank, Investec",http://www.reuters.com/article/2014/02/10/financial-moves-idUSL3N0LF41520140210,
20140210 3:26PM UTC,Goldman Sachs names Varadhan as third securities co-head: memo,http://www.reuters.com/article/2014/02/10/us-goldman-varadhan-idUSBREA191U820140210,
20140210 3:01PM UTC,Goldman Sachs names Varadhan as third securities co-head -memo,http://www.reuters.com/article/2014/02/10/goldman-varadhan-idUSL2N0LF1AU20140210,
20140210 1:59PM UTC,Zillow to Participate in the Goldman Sachs 2014 Technology and Internet Conference,http://www.reuters.com/article/2014/02/10/idUSnGNX7Lm6WF+1d3+GNW20140210,
20140210 9:52AM UTC,New Issue- Goldman Sachs prices 1.0 bln euro 2021 bond,http://www.reuters.com/article/2014/02/10/idUSL3N0LF4HG20140210,
20140210 8:30AM UTC,"Polycom to Present at Goldman Sachs Technology & Internet Conference and Morgan Stanley Technology, Media & Telecom Conference",http://www.reuters.com/article/2014/02/10/ca-polycom-idUSnBw105380a+100+BSW20140210,
20140210 8:00AM UTC,Xerox Executive to Speak at Goldman Sachs Technology and Internet Conference,http://www.reuters.com/article/2014/02/10/ct-xerox-idUSnBw105415a+100+BSW20140210,
20140211 3:57PM UTC,"MOVES-Goldman Sachs, RBC Wealth Management, Greenhill, Westpac",http://www.reuters.com/article/2014/02/11/financial-moves-idUSL3N0LG2KH20140211,
20140211 2:45PM UTC,Flextronics To Present At The Goldman Sachs 2014 Technology And Internet Conference,http://www.reuters.com/article/2014/02/11/ca-flextronics-idUSnPnSFrp1wN+161+PRN20140211,
20140211 2:41PM UTC,Goldman Sachs adds five executives to management committee: memos,http://www.reuters.com/article/2014/02/11/us-goldman-committee-idUSBREA1A1TD20140211,
20140211 1:54PM UTC,UPDATE 1-Goldman Sachs adds five execs to management committee -memos,http://www.reuters.com/article/2014/02/11/goldman-committee-idUSL2N0LG1FX20140211,
20140211 12:34PM UTC,Goldman Sachs adds five executives to management committee-memos,http://www.reuters.com/article/2014/02/11/goldman-committee-idUSL2N0LG1DF20140211,
20140212 3:53PM UTC,"MOVES- Goldman Sachs, Banco Do Brasil, Ecobank, Brooks Macdonald",http://www.reuters.com/article/2014/02/12/financial-moves-idUSL3N0LH3VN20140212,
20140212 12:00PM UTC,"Today, DeemÂ® joins CardLinx CEO to Present at Goldman Sachs Technology Conference",http://www.reuters.com/article/2014/02/12/ca-deem-idUSnBw125453a+100+BSW20140212,
20140212 7:05AM UTC,Marketo to Present at Goldman Sachs Technology and Internet Conference 2014,http://www.reuters.com/article/2014/02/12/ca-marketo-conference-idUSnPnSFrxsfy+160+PRN20140212,
20140212 5:02AM UTC,Goldman Sachs chief FX strategist Thomas Stolper to leave bank,http://www.reuters.com/article/2014/02/12/goldman-fx-idUSL5N0LH1N320140212,
20140214 2:15PM UTC,Goldman Sachs to advise Spain on Bankia stake sale: FROB,http://www.reuters.com/article/2014/02/14/us-spain-bankia-goldman-idUSBREA1D1II20140214,
20140214 2:10PM UTC,UPDATE 1-Goldman Sachs to advise Spain on Bankia stake sale - FROB,http://www.reuters.com/article/2014/02/14/spain-bankia-goldman-idUSL5N0LJ3R920140214,
20140214 12:10PM UTC,Goldman Sachs to advise Spain on Bankia stake sale - sources,http://www.reuters.com/article/2014/02/14/spain-bankia-goldman-idUSE8N0G000320140214,
20140214 8:33AM UTC,BRIEF-Rhoen Klinikum says Goldman Sachs holds 3.02 percent of the voting rights,http://www.reuters.com/article/2014/02/14/rhoenklinikum-brief-idUSWEB00II220140214,
20140218 9:35AM UTC,New Issue- Goldman Sachs prices 175 mln sfr 2019 bond,http://www.reuters.com/article/2014/02/18/idUSL3N0LN4EI20140218,
20140220 3:19PM UTC,"Goldman Sachs misses out on WhatsApp, 2014's top deals so far",http://www.reuters.com/article/2014/02/20/us-goldmansachs-facebook-idUSBREA1J21020140220,
20140220 3:16PM UTC,"Goldman Sachs misses out on WhatsApp, 2014's top deals so far",http://www.reuters.com/article/2014/02/20/goldmansachs-facebook-idUSL2N0LP1OG20140220,
20140221 3:38PM UTC,Fitch Expects to Rate Goldman Sachs International Bank CD Programme 'A/F1',http://www.reuters.com/article/2014/02/21/ny-fitch-ratings-gsib-idUSnBw215873a+100+BSW20140221,
20140221 3:16PM UTC,Fitch Expects to Rate Goldman Sachs International Bank CD Programme 'A/F1',http://www.reuters.com/article/2014/02/21/fitch-expects-to-rate-goldman-sachs-inte-idUSFit69129820140221,
20140225 5:30PM UTC,Goldman Sachs Conference Call to Announce First Quarter 2014 Results,http://www.reuters.com/article/2014/02/25/ny-goldman-sachs-group-idUSnBw257156a+100+BSW20140225,
20140225 4:10PM UTC,AJ Murphy joins Goldman Sachs' leveraged finance team,http://www.reuters.com/article/2014/02/25/moves-leveragedfinance-ajmurphy-idUSL6N0LU4Q420140225,
20140226 11:00AM UTC,Sanderson Farms to Participate in Goldman Sachs Agribusiness Conference,http://www.reuters.com/article/2014/02/26/ms-sanderson-farms-idUSnBw266052a+100+BSW20140226,
20140227 9:30AM UTC,"The Zacks Analyst Blog Highlights:Morgan Stanley, Citigroup, Goldman Sachs Group, JPMorgan Chase and General Motors",http://www.reuters.com/article/2014/02/27/il-zacks-investments-idUSnPnCGw8rkT+161+PRN20140227,
20140228 6:26PM UTC,Fitch Rates Goldman Sachs Limited Maturity Obligations Fund 'AAA/V1',http://www.reuters.com/article/2014/02/28/ny-fitch-ratings-goldman-idUSnBw286017a+100+BSW20140228,
20140228 11:48AM UTC,Goldman Sachs faces new regulatory probes-filing,http://www.reuters.com/article/2014/02/28/goldman-probes-idUSL1N0LX1N820140228,
20140303 9:17AM UTC,Goldman Sachs names Apple's Oppenheimer to board,http://www.reuters.com/article/2014/03/03/us-goldman-apple-board-idUSBREA2215T20140303,
20140303 9:07AM UTC,Goldman Sachs names Apple's Oppenheimer to board,http://www.reuters.com/article/2014/03/03/goldman-apple-board-idUSL3N0M04EM20140303,
20140303 8:45AM UTC,Peter Oppenheimer Joins Goldman Sachs Board of Directors,http://www.reuters.com/article/2014/03/03/ny-goldman-sachs-idUSnBw035847a+100+BSW20140303,
20140304 4:05PM UTC,Intrepid to Present at Goldman Sachs Agribusiness Conference,http://www.reuters.com/article/2014/03/04/idUSnHUGdycq+70+ONE20140304,
20140305 4:05PM UTC,Mosaic To Present At Goldman Sachs Agribusiness Conference,http://www.reuters.com/article/2014/03/05/mn-mos-goldman-sachs-idUSnPnCGxjtzS+161+PRN20140305,
20140305 4:01PM UTC,Bunge Limited to Address Goldman Sachs Agribusiness Conference,http://www.reuters.com/article/2014/03/05/bunge-goldman-conf-idUSnPnNYxH6zN+169+PRN20140305,
20140305 11:53AM UTC,"Financial Companies Report Appointments, Recognitions, Stock Movements, and Conference Schedules - Analyst Notes on Goldman Sachs, Morgan Stanley, AIG, Schwab, and Prudential Financial",http://www.reuters.com/article/2014/03/05/bc-analysts-review-idUSnPnpHMyq8+98+PRN20140305,
20140305 9:00AM UTC,Ancestry.com LLC Announces Participation in Goldman Sachs TMT Leveraged Finance Conference,http://www.reuters.com/article/2014/03/05/idUSnGNXbWBDnL+1dd+GNW20140305,
20140305 7:32AM UTC,"CORRECTED-MOVES- Goldman Sachs, BNY Mellon, Willis Group, Fitch (March 3)",http://www.reuters.com/article/2014/03/05/financial-moves-idUSL3N0M04O920140305,
20140306 4:22PM UTC,"UBS taps bankers from Credit Suisse, Goldman Sachs",http://www.reuters.com/article/2014/03/06/ubs-bankers-idUSL1N0M32BE20140306,
20140306 6:45AM UTC,Goldman Sachs head of oil and ags Karl Robijns to retire - memo,http://www.reuters.com/article/2014/03/06/goldman-commodities-robijns-idUSL6N0M326P20140306,
20140307 8:01PM UTC,"Exclusive: Goldman Sachs unit, Vestar near $1.1 billion deal for Hearthside Food - sources",http://www.reuters.com/article/2014/03/08/us-hearthside-sale-idUSBREA2701220140308,
20140308 1:14PM UTC,Goldman Sachs partners reduce stake in company,http://www.reuters.com/article/2014/03/08/goldman-insiders-idUSL2N0M506Y20140308,
20140311 4:05PM UTC,CVR Partners to Participate in Goldman Sachs 18th Annual Agribusiness Conference,http://www.reuters.com/article/2014/03/11/tx-cvr-goldman-sachs-idUSnPnDAz0wzS+161+PRN20140311,
20140312 8:30AM UTC,Windstream SVP & Treasurer Bob Gunderman to Speak at Goldman Sachs Conference,http://www.reuters.com/article/2014/03/12/idUSnGNX5cLqpt+1c8+GNW20140312,
20140312 7:00AM UTC,Microsemi to Present at Goldman Sachs Fifth Annual TMT Leveraged Finance Conference,http://www.reuters.com/article/2014/03/12/microsemi-at-goldman-idUSnPnLAz1Nfs+164+PRN20140312,
20140205 4:01PM UTC,VMware to Present at the Goldman Sachs Technology and Internet Conference,http://www.reuters.com/article/2014/02/05/idUSnMKWVY71ha+1f0+MKW20140205,
20140205 2:05PM UTC,Motorola Solutions to Present at Feb. 12 Goldman Sachs Technology and Internet Conference,http://www.reuters.com/article/2014/02/05/il-motorola-solutions-idUSnBw056281a+100+BSW20140205,
20140205 11:00AM UTC,TI Chief Financial Officer Kevin March to speak at Goldman Sachs investor conference,http://www.reuters.com/article/2014/02/05/texas-instruments-idUSnPnDApCDp8+16c+PRN20140205,
20140205 10:41AM UTC,Two senior Goldman Sachs forex traders retire-source,http://www.reuters.com/article/2014/02/05/goldman-forex-idUSL2N0LA0XW20140205,
20140205 9:00AM UTC,Tableau Software to Present at 2014 Goldman Sachs Technology and Internet Conference,http://www.reuters.com/article/2014/02/05/tableau-software-idUSnPnSFpbRkj+164+PRN20140205,
20140205 9:00AM UTC,CSG International to Participate in Goldman Sachs Technology & Internet Conference 2014,http://www.reuters.com/article/2014/02/05/co-csg-international-idUSnBw055003a+100+BSW20140205,
20140205 8:01AM UTC,OpenTable to Participate in the Goldman Sachs Technology and Internet Conference,http://www.reuters.com/article/2014/02/05/ca-opentablegoldman-idUSnPnNYltkhp+160+PRN20140205,
20140205 8:00AM UTC,Jive Software to Present at the Goldman Sachs Technology and Internet Conference,http://www.reuters.com/article/2014/02/05/idUSnGNX91NZKL+1cf+GNW20140205,
20140205 8:00AM UTC,Gigamon to Participate in Goldman Sachs Conference,http://www.reuters.com/article/2014/02/05/gimo-goldmansachs-idUSnPnSFpXXhn+16c+PRN20140205,
20140205 8:00AM UTC,Conversant to Present at Goldman Sachs Technology and Internet Conference on February 13,http://www.reuters.com/article/2014/02/05/ca-conversant-inc-idUSnBw055181a+100+BSW20140205,
20140313 4:15PM UTC,"DuPont Fabros Technology, Inc. To Present At The Goldman Sachs TMT Leveraged Finance Conference",http://www.reuters.com/article/2014/03/13/dc-dupont-fabros-idUSnPnPHzL5B3+16a+PRN20140313,
20140313 1:30PM UTC,Amkor Technology to Present at Goldman Sachs TMT Leveraged Finance Conference,http://www.reuters.com/article/2014/03/13/az-amkor-technology-idUSnBw136124a+100+BSW20140313,
20140506 6:03PM UTC,Goldman Sachs extends loan to Steven A. Cohen,http://www.reuters.com/article/2014/05/06/us-hedgefunds-cohen-idUSBREA4510W20140506,
20140506 3:44PM UTC,Goldman Sachs extends loan to Steven A. Cohen,http://www.reuters.com/article/2014/05/06/us-hedgefunds-cohen-idUSBREA450TJ20140506,
20140506 3:41PM UTC,Goldman Sachs extends loan to Steven A. Cohen,http://www.reuters.com/article/2014/05/06/hedgefunds-cohen-idUSL2N0NS1KB20140506,
20140506 10:00AM UTC,REG-Philip Morris International Inc. Philip Morris International Inc. to Host Webcast of Presentation at Goldman Sachs Global Staples Summit,http://www.reuters.com/article/2014/05/06/philip-morris-intl-idUSnBw066180a+100+BSW20140506,
20140506 10:00AM UTC,Philip Morris International Inc. to Host Webcast of Presentation at Goldman Sachs Global Staples Summit,http://www.reuters.com/article/2014/05/06/ny-philip-morris-idUSnBw066154a+100+BSW20140506,
20140506 9:00AM UTC,"Upcoming Conferences, Quarterly Earnings Releases, New Branches, and Stock Price Updates - Analyst Notes on American Express, Ocwen, ICICI, Goldman Sachs and American Tower",http://www.reuters.com/article/2014/05/06/bc-analystsreviewcom-idUSnPnc1bSWJ+87+PRN20140506,
20140506 8:35AM UTC,Advisory:  RAI to webcast CEO's participation at Goldman Sachs summit,http://www.reuters.com/article/2014/05/06/reynolds-american-web-idUSnPn26y48V+81+PRN20140506,
20140506 8:00AM UTC,"Lorillard To Participate In The Goldman Sachs Global Staples Summit On Tuesday, May 13, 2014",http://www.reuters.com/article/2014/05/06/nc-lorillard-tobacco-idUSnPnbxF2b8+88+PRN20140506,
20140611 6:55PM UTC,Goldman Sachs and Bain Capital Agree to $121 Million Settlements in LBO Antitrust Violations Case,http://www.reuters.com/article/2014/06/11/robins-kaplan-miller-idUSnPn6fhSZn+86+PRN20140611,
20140611 3:14PM UTC,Goldman Sachs Announces Pricing of Tender Offer for 6.345% Capital Securities of Goldman Sachs Capital I,http://www.reuters.com/article/2014/06/11/ny-goldman-sachs-group-idUSnBw116422a+100+BSW20140611,
20140611 8:30AM UTC,2U CEO and Co-Founder Chip Paucek to Speak at the 2014 Goldman Sachs - Harvard University Global Education Conference,http://www.reuters.com/article/2014/06/11/2u-global-edu-conf-idUSnPn8JR1Mn+9a+PRN20140611,
20140611 3:26AM UTC,Goldman Sachs places Kion shares at 32.70 eur apiece-sources,http://www.reuters.com/article/2014/06/11/kiongroup-goldmansachs-price-idUSWEB00O9F20140611,
20140717 4:00PM UTC,"Notice of CONDITIONAL FULL Redemption Corporate Backed Trust Certificates, Goldman Sachs Capital I Securities-Backed Series 2004-4 Trust 429,000 $25 Par ($10,725,000 Certificate Principal Amount) Class A-1 Certificates Due F",http://www.reuters.com/article/2014/07/17/idUSnMKWNPW72a+1f8+MKW20140717,
