20140102 8:30AM UTC,Johnson & Johnson Announces Quarterly Dividend for First Quarter 2014,http://www.reuters.com/article/2014/01/02/johnsonjohnson-div-idUSnPnNYgzqhY+161+PRN20140102,
20140103 9:30AM UTC,"Broadridge Financial Solutions, VeriFone Systems, Gilead Sciences, Johnson & Johnson and Forest Laboratories highlighted as Zacks Bull and Bear of the Day",http://www.reuters.com/article/2014/01/03/il-zacks-investments-idUSnPnCGgLwkT+169+PRN20140103,
20140107 8:00AM UTC,"Upcoming Conference Participations, Cash Dividends, and Share Price Movements - Research Report on Johnson & Johnson, Boston Scientific, NuVasive, Exelixis, and Healthways",http://www.reuters.com/article/2014/01/07/bc-analysts-corner-idUSnPn7zpghn+80+PRN20140107,
20140108 6:17PM UTC,Janssen Pharmaceutical Companies of Johnson & Johnson Submit Citizen Petition to the U.S. FDA Regarding Naming of Biosimilars,http://www.reuters.com/article/2014/01/08/janssen-petition-fda-idUSnPnDCj0nFC+163+PRN20140108,
20140108 8:00AM UTC,"Johnson & Johnson Innovation Expands Global Incubator Presence to Israel and Announces Multiple, Diverse, Early-Stage Collaborations with Academia and Biotech",http://www.reuters.com/article/2014/01/08/nj-johnson-johnson-idUSnBw085519a+100+BSW20140108,
20140108 8:00AM UTC,Scholar Rock Announces Collaboration with Johnson & Johnson Innovation to Discover and Develop Novel Biologics for the Treatment of Autoimmune Diseases and Cancer,http://www.reuters.com/article/2014/01/08/ma-scholar-rock-idUSnBw085574a+100+BSW20140108,
20140108 8:00AM UTC,Nodality Enters into a Strategic Collaboration with Johnson & Johnson Innovation in Autoimmune Diseases,http://www.reuters.com/article/2014/01/08/ca-nodality-idUSnBw085105a+100+BSW20140108,
20140109 9:52AM UTC,"Research and Markets: Urinary Incontinence Global Clinical Trials Review, H2 2013 Report Features Players such as Allergan, Inc., Johnson & Johnson and Boehringer Ingelheim GmbH",http://www.reuters.com/article/2014/01/09/research-and-markets-idUSnBw095743a+100+BSW20140109,
20140109 9:00AM UTC,"Johnson & Johnson Official 7 Minute Workout App Now Available For iPhone, iPad, iPod touch and Android Smartphones and Tablets",http://www.reuters.com/article/2014/01/09/mi-wellnesspreventio-idUSnPnCGhQlkj+168+PRN20140109,
20140109 5:06AM UTC,Johnson & Johnson to appeal China revoking diabetes trademark,http://www.reuters.com/article/2014/01/09/us-johnsonjohnson-china-idUSBREA080D720140109,
20140109 5:02AM UTC,Johnson & Johnson to appeal China revoking diabetes trademark,http://www.reuters.com/article/2014/01/09/johnsonjohnson-china-idUSL3N0KJ2R020140109,
20140110 8:00AM UTC,"Clinical Study Updates, Milestones Achievements, and Stock Price Movements - Research Report on Johnson & Johnson, Epizyme, Health Management, DENTSPLY, and Charles River",http://www.reuters.com/article/2014/01/10/bc-analysts-corner-idUSnPn7ND5hn+98+PRN20140110,
20140113 11:08AM UTC,Adaptive Announces a Biomarker Discovery Agreement with Johnson & Johnson Innovation,http://www.reuters.com/article/2014/01/13/adaptive-newagreement-idUSnPnSFjBspj+168+PRN20140113,
20140114 9:49AM UTC,Leading Life Sciences CEOs Honor Johnson & Johnson Chief Scientific Officer Paul Stoffels with Lifetime Achievement Award at Annual East/West CEO Conference,http://www.reuters.com/article/2014/01/14/ca-east-west-ceo-conf-idUSnBw146056a+100+BSW20140114,
20140114 8:00AM UTC,"Healthcare Companies Report Petition Submission, Pricing of Follow-On Offerings and Stock Price Movements - Research Report on Johnson & Johnson, GW Pharma, Conatus Pharma, Chelsea, and Insmed",http://www.reuters.com/article/2014/01/14/bc-ac-idUSnPn84wvhn+80+PRN20140114,
20140116 7:45AM UTC,Johnson & Johnson Announces Binding Offer From The Carlyle Group To Acquire Ortho-Clinical Diagnostics,http://www.reuters.com/article/2014/01/16/johnsonjohnson-merge-idUSnPnNYkClgk+168+PRN20140116,
20140116 7:45AM UTC,The Carlyle Group Agrees to Acquire Johnson & Johnsonâ€™s Ortho-Clinical Diagnostics for $4.15 Billion,http://www.reuters.com/article/2014/01/16/ny-the-carlyle-group-idUSnBw165686a+100+BSW20140116,
20140121 12:38PM UTC,MD Anderson Announces Collaboration With Johnson & Johnson Innovation On Cancer Immunotherapy,http://www.reuters.com/article/2014/01/21/mdandersonimmunothrpy-idUSnPnDClfbpc+160+PRN20140121,
20140121 7:57AM UTC,Johnson & Johnson beats Q4 forecasts as drug sales shine,http://www.reuters.com/article/2014/01/21/johnsonandjohnson-results-idUSL2N0KV01Q20140121,
20140121 7:45AM UTC,Johnson & Johnson Reports 2013 Fourth-Quarter and Full-Year Results:,http://www.reuters.com/article/2014/01/21/johnsonjohnson-earns-idUSnPnNYlk4gk+160+PRN20140121,
20140122 11:28AM UTC,"DePuy ASR Lawsuit News: DePuy ASR Hip Recall Continues to Impact Johnson & Johnson Earnings, Bernstein Liebhard LLP Reports",http://www.reuters.com/article/2014/01/22/ny-bernstein-liebhard-idUSnPnNYlMvpH+169+PRN20140122,
20140129 11:21AM UTC,"Risperdal Lawsuit News: Johnson & Johnson Wins Appeal of $257 Million Louisiana Risperdal Verdict, Bernstein Liebhard LLP Reports",http://www.reuters.com/article/2014/01/29/ny-bernstein-suitnews-idUSnPnNYnnzpy+160+PRN20140129,
20140130 8:00AM UTC,Johnson & Johnson Announces Clinical Trial Data Sharing Agreement With Yale School of Medicine,http://www.reuters.com/article/2014/01/30/johnsonjohnson-yoda-idUSnPnNYnCWhn+16c+PRN20140130,
20140130 12:01AM UTC,Johnson & Johnson Announces Clinical Trial Data Sharing Agreement With Yale School of Medicine,http://www.reuters.com/article/2014/01/30/johnsonjohnson-yoda-idUSnPnNYnbf1+b0+PRN20140130,
20140203 9:00AM UTC,Johnson & Johnson Issues Dr. Paul Janssen Award for Biomedical Research Call for Nominations,http://www.reuters.com/article/2014/02/03/johnsonjohnson-award-idUSnPnNYp74kj+160+PRN20140203,
20140211 9:00AM UTC,Johnson & Johnson and Scientists Without Borders Announce Winners of Mental Health Awareness Challenge,http://www.reuters.com/article/2014/02/11/ny-johnsonjohnson-idUSnPnNYr4Nkj+164+PRN20140211,
20140214 3:30PM UTC,Decision Diagnostics Announces Agreement for the Funding of Its Prosecution of Anti-Trust and False Advertising Suits Against Division of Johnson & Johnson,http://www.reuters.com/article/2014/02/14/idUSnMKW38LP9a+1cc+MKW20140214,
20140214 7:45AM UTC,Johnson & Johnson to Participate in 2014 Citi Global Health Care Conference,http://www.reuters.com/article/2014/02/14/johnsonjohnsonconf-idUSnPnNYs80gk+160+PRN20140214,
20140218 11:25AM UTC,Decision Diagnostics Announces Agreement for Funding of Its Prosecution of Anti-Trust and False Advertising Suits Against Division of Johnson & Johnson,http://www.reuters.com/article/2014/02/18/idUSnMKW4TB5Qa+1da+MKW20140218,
20140221 9:30AM UTC,"The Zacks Analyst Blog Highlights: Priceline, Groupon, Bayer, Johnson & Johnson and Alexion Pharmaceuticals",http://www.reuters.com/article/2014/02/21/il-zacks-investment-idUSnPnCGtFYkT+16d+PRN20140221,
20140225 7:45AM UTC,Johnson & Johnson to Participate in 2014 Cowen 34th Annual Health Care Conference,http://www.reuters.com/article/2014/02/25/johnsonjohnsoncowen-idUSnPnNYvgngk+160+PRN20140225,
20140226 4:46PM UTC,"Research and Markets: North America Weight Loss/Obesity Management Market - Forecasts to 2017: Featuring Players such as Atkins Nutritionals, Inc and Johnson & Johnson",http://www.reuters.com/article/2014/02/26/research-and-markets-idUSnBw266685a+100+BSW20140226,
20140228 11:31AM UTC,"Risperdal Lawsuit News: Arkansas Supreme Court Hears Johnson & Johnson Appeal of $1.2 Billion Risperdal Verdict, Bernstein Liebhard LLP Reports.",http://www.reuters.com/article/2014/02/28/ny-bernstein-liebhard-idUSnPnNYwwMpL+165+PRN20140228,
20140306 1:52PM UTC,"Johnson & Johnson Launches Champions of Care"" Program in the U.S as Part of 2014 FIFA World Cupâ„¢ Sponsorship""",http://www.reuters.com/article/2014/03/06/nj-johnsonjohnson-idUSnPnCGy0Jv0+164+PRN20140306,
20140310 8:00AM UTC,Alector Teams Up with Johnson & Johnson Innovation to Explore Novel Alzheimer's Target,http://www.reuters.com/article/2014/03/10/alector-alzheimers-idUSnPnLAynPhn+164+PRN20140310,
20140310 4:52AM UTC,BRIEF-Reckitt Benckiser to buy K-Y brand from Johnson & Johnson's unit,http://www.reuters.com/article/2014/03/10/reckittbenckiser-brief-idUSWLB007KH20140310,
20140310 4:43AM UTC,Reckitt Benckiser to buy K-Y from Johnson & Johnson,http://www.reuters.com/article/2014/03/10/us-reckittbenckiser-ky-idUSBREA290BZ20140310,
20140310 4:41AM UTC,Reckitt Benckiser to buy K-Y from Johnson & Johnson,http://www.reuters.com/article/2014/03/10/reckittbenckiser-ky-idUSL6N0M70WN20140310,
20140311 4:15PM UTC,Johnson & Johnson to Host Analyst Conference Call on First-Quarter Results,http://www.reuters.com/article/2014/03/11/nj-jj-q1-conf-call-idUSnPnNYz4hB3+162+PRN20140311,
20140312 8:00AM UTC,"Collaborations, Treatment Approvals, New Solutions, Clinical Trial Results, and New Drug Applications - Analyst Notes on Biogen Idec, Johnson & Johnson, Express Scripts, Merck, and Forest Laboratories",http://www.reuters.com/article/2014/03/12/bc-analysts-review-idUSnPnqbXthn+88+PRN20140312,
20140331 7:45AM UTC,Johnson & Johnson Announces Acceptance Of Binding Offer From The Carlyle Group To Acquire Ortho-Clinical Diagnostics,http://www.reuters.com/article/2014/03/31/jj-orthoclin-acquire-idUSnPn9pQ9V6+8a+PRN20140331,
20140804 8:50AM UTC,"Drug Approvals and Earnings Releases - Research Reports on Bristol-Myers, Johnson & Johnson, Merck, Pharmacyclics and Amgen",http://www.reuters.com/article/2014/08/04/bc-ar-idUSnPnbhrQ3h+84+PRN20140804,
20140822 9:30AM UTC,"The Zacks Analyst Blog Highlights: Johnson & Johnson, Tekmira Pharmaceuticals, GileadSciences, Allergan and Supernus Pharmaceuticals",http://www.reuters.com/article/2014/08/21/il-zacks-investment-idUSnPn78qKWr+86+PRN20140821,
20140822 9:20AM UTC,"Research and Markets: Global Medical Devices Market Report 2014-2018: Covidien, F. Hoffmann-La Roche, GE Healthcare, Johnson & Johnson & Medtronic Dominate the Industry",http://www.reuters.com/article/2014/08/21/research-and-markets-idUSnBw215601a+100+BSW20140821,
20140909 9:30AM UTC,"The Zacks Analyst Blog Highlights: Intel, Advanced Micro Devices, Johnson & Johnson, Bayer and McDonald's",http://www.reuters.com/article/2014/09/08/ilzacksinvestmentblog-idUSnPng7Kml+44+PRN20140908,
20141015 7:45AM UTC,Johnson & Johnson Reports 2014 Third-Quarter Results:,http://www.reuters.com/article/2014/10/14/ny-johnsonjohnson-idUSnPn5GvRN5+96+PRN20141014,
20141120 8:20PM UTC,Johnson & Johnson Partners with Save the Children to Help Millions of Children over the Next Three Years,http://www.reuters.com/article/2014/11/20/jj-save-the-children-idUSnPn7TrLPF+97+PRN20141120,
20141120 1:37AM UTC,BRIEF-Raisio acquired Benecol business from affiliates of Johnson & Johnson,http://www.reuters.com/article/2014/11/19/raisio-brief-idUSFWN0T803520141119,
20140319 8:00AM UTC,"Health Care Stocks Review -- Research on Bristol-Myers Squibb, Johnson & Johnson, Merck & Co. and Eli Lilly",http://www.reuters.com/article/2014/03/19/bc-ie-idUSnPn84H60N+89+PRN20140319,
20140320 11:46AM UTC,BRIEF-Johnson & Johnson wins reversal of $1.2 bln Risperdal judgment,http://www.reuters.com/article/2014/03/20/johnsonandjohnson-brief-idUSWEN00CQV20140320,
20140320 8:00AM UTC,"Healthcare Companies Report FDA Approvals, Comprehensive Analysis, Schedules, and Stock Movements - Analyst Notes on Pfizer, Johnson & Johnson, Biogen, Express Scripts, and Forest Laboratories",http://www.reuters.com/article/2014/03/20/bc-ar-idUSnPn21yXBx+86+PRN20140320,
20140321 7:45AM UTC,Johnson & Johnson to Webcast Annual Meeting of Shareholders,http://www.reuters.com/article/2014/03/21/johnsonjohnson-cast-idUSnPnbQ35H5+92+PRN20140321,
20140324 9:30AM UTC,"Gain Capital Holdings, Vail Resorts, Johnson & Johnson, Alkermes and Alexion Pharmaceuticals highlighted as Zacks Bull and Bear of the Day",http://www.reuters.com/article/2014/03/24/zacks-investment-idUSnPnb9vKZc+86+PRN20140324,
20140327 3:08PM UTC,Fitch Affirms Johnson & Johnson at 'AAA'; Outlook Stable,http://www.reuters.com/article/2014/03/27/ny-fitch-ratings-jnj-idUSnBw276287a+100+BSW20140327,
20140327 2:58PM UTC,Fitch Affirms Johnson & Johnson at 'AAA'; Outlook Stable,http://www.reuters.com/article/2014/03/27/fitch-affirms-johnson-johnson-at-aaa-out-idUSFit69465220140327,
20140328 8:00AM UTC,"Positive Opinions, Presentation Schedules of Investigational Data, Clinical Study Results, and Stock Price Movements - Analyst Notes on Johnson & Johnson, Merck, Pfizer, Amgen, and Allergan",http://www.reuters.com/article/2014/03/28/bc-analysts-review-idUSnPnbFJ7c4+98+PRN20140328,
20140401 12:09PM UTC,Johnson & Johnson Enters Agreement to be Official Healthcare Partner of the USO,http://www.reuters.com/article/2014/04/01/johnsonjohnson-uso-idUSnPn2yzgvR+81+PRN20140401,
20140402 9:30AM UTC,"The Zacks Analyst Blog Highlights: Microsoft, Hewlett-Packard, Google, Apple and Johnson & Johnson",http://www.reuters.com/article/2014/04/02/zacks-equity-research-idUSnPnqn2St+42+PRN20140402,
20140403 8:02AM UTC,"Healthcare Companies Report Transactions, Appeals, New Research Findings and Stock Movements - Analyst Notes on Johnson & Johnson, Teva, Celgene, Cara Therapeutics, and OncoMed Pharmaceuticals",http://www.reuters.com/article/2014/04/03/bc-analystsreviewcom-idUSnPnbKHvpc+98+PRN20140403,
20140407 12:35PM UTC,"Technical Pointers on Pharmaceuticals Equities -- Research on Merck, Bristol-Myers Squibb, Johnson & Johnson, and Eli Lilly",http://www.reuters.com/article/2014/04/07/bc-ie-idUSnPn7mLfmt+88+PRN20140407,
20140407 8:01AM UTC,"NDA Filings, FDA Approvals, Executive Appointments, Ceased Clinical Trials, and Public Offerings - Analyst Notes on Johnson & Johnson, Pfizer, Merck, GSK, and Intercept",http://www.reuters.com/article/2014/04/07/bc-analysts-review-idUSnPn7vZLT5+8e+PRN20140407,
20140408 8:01AM UTC,"Conference Call Schedules, Clinical Trial Studies, Awards and Accolades, Appointments, and Welfare Initiatives - Analyst Notes on Celgene, Johnson & Johnson, Merck, Sanofi, and UnitedHealth",http://www.reuters.com/article/2014/04/08/bc-analysts-review-idUSnPn2NrqJj+92+PRN20140408,
20140409 2:21PM UTC,UniStrip Technologies Introduces Generic Blood Glucose Test Strips For Use With Johnson & Johnson's OneTouchÂ® UltraÂ® Meters.,http://www.reuters.com/article/2014/04/09/nc-unistrip-generic-idUSnPn7rtXwQ+85+PRN20140409,
20140415 7:45AM UTC,Johnson & Johnson Reports 2014 First-Quarter Results:,http://www.reuters.com/article/2014/04/15/nj-jj-q1-earnings-idUSnPnFhCWK+57+PRN20140415,
20140421 9:30AM UTC,"The Zacks Analyst Blog Highlights:JPMorgan, Pfizer, Coca-Cola, Johnson & Johnson and IBM",http://www.reuters.com/article/2014/04/21/zacks-equity-research-idUSnPn4db1FB+83+PRN20140421,
20140422 6:23AM UTC,"Research and Markets: Global Arthroscopy Devices Market 2014-2018 with Arthrex Inc., CONMED Corp., Johnson & Johnson and Smith & Nephew Dominating",http://www.reuters.com/article/2014/04/22/research-and-markets-idUSnBw225737a+100+BSW20140422,
20140423 2:00PM UTC,"Compliance and ethics case studies offered by Dell, Aetna, Bain Capital, Mercer, The Nature Conservancy, Johnson & Johnson, Gallup and others to be featured at SCCE's 13th Annual Compliance & Ethics Institute",http://www.reuters.com/article/2014/04/23/scce-ethics-institute-idUSnPncgJpWB+8b+PRN20140423,
20140423 2:00PM UTC,Johnson & Johnson to Host Medical Devices & Diagnostics Business Review,http://www.reuters.com/article/2014/04/23/nj-jnj-hosts-review-idUSnPnb5XBQB+8f+PRN20140423,
20140424 2:11PM UTC,"Research and Markets: United States Facial Care Market 2014-2018 with Johnson & Johnson, L'OrÃ©al, Procter & Gamble & Unilever Group Dominating the $13 Billion Industry",http://www.reuters.com/article/2014/04/24/research-and-markets-idUSnBw246423a+100+BSW20140424,
20140424 10:22AM UTC,Johnson & Johnson Announces Dividend Increase of 6.1%,http://www.reuters.com/article/2014/04/24/johnsonjohnson-div-idUSnPn5VP80l+98+PRN20140424,
20140424 8:00AM UTC,"Quarterly Results, FDA Approvals, Intellectual Property Appeals, New Drug Applications, and Initiated Clinical Trials - Analyst Notes on Johnson & Johnson, Merck, Teva, Bristol-Myers Squibb and AbbVie",http://www.reuters.com/article/2014/04/24/bc-a-idUSnPn8Z5y4M+91+PRN20140424,
20140425 8:00AM UTC,"Drug Approvals, Quarterly Earnings Releases, and Stock Price Updates - Analyst Notes on Merck, Johnson & Johnson, UnitedHealth, Celgene and GW",http://www.reuters.com/article/2014/04/25/bc-analysts-review-idUSnPn6xMcht+88+PRN20140425,
20140429 12:04PM UTC,"Technical Briefing on Equities Reaching New high -- Research on Johnson & Johnson, Berkshire Hathaway, HollyFrontier, and Crown Holdings",http://www.reuters.com/article/2014/04/29/bc-i-idUSnPnbT5jrb+90+PRN20140429,
20140429 8:30AM UTC,Johnson & Johnson Announces New Collaboration with Stop TB Partnership's Global Drug Facility to Enhance Access to Anti-TB Compound,http://www.reuters.com/article/2014/04/29/nj-johnsonjohnson-idUSnPn2Jn4Yt+92+PRN20140429,
20140430 8:00AM UTC,Johnson & Johnson and American College of Sports Medicine Form Global Alliance to Advance Human Health and Performance,http://www.reuters.com/article/2014/04/30/ny-jjallhumhealperf-idUSnPn6ZbbK8+92+PRN20140430,
20140502 8:01AM UTC,"Approvals from the European Commission and Release of Quarterly Financial Results - Analyst Notes on Merck, Johnson & Johnson, Bristol-Myers Squibb, Teva and AbbVie",http://www.reuters.com/article/2014/05/02/bc-analysts-review-idUSnPn6TV8kV+99+PRN20140502,
20140505 3:54PM UTC,"Johnson & Johnson Announces U.S. Champions of Care"" Program Finalists as Part of 2014 FIFA World Cup Brazilâ„¢ Sponsorship""",http://www.reuters.com/article/2014/05/05/johnson-johnson-idUSnPn5cbwD8+82+PRN20140505,
20140505 8:00AM UTC,"Stock Movements, Senior Level Appointments, Quarterly Earnings Release, New Agreement, and Drug Approvals - Analyst Notes on Sallie Mae, Visa, MasterCard, Willis and Johnson & Johnson",http://www.reuters.com/article/2014/05/05/bc-analystsreviewcom-idUSnPn9Jnkbz+90+PRN20140505,
20140507 10:00AM UTC,Corporate Action Network: Injured Women Call on Johnson & Johnson to Immediately Stop Producing Dangerous Pelvic Mesh Implants,http://www.reuters.com/article/2014/05/07/nj-corp-action-network-idUSnBw075446a+100+BSW20140507,
20140508 9:30AM UTC,"The Zacks Analyst Blog Highlights:Ruth's Hospitality Group, Denny's, Bayer, Merck and Johnson & Johnson",http://www.reuters.com/article/2014/05/08/zacks-analyst-blog-idUSnPn45gPq8+84+PRN20140508,
20140512 3:37PM UTC,"Research and Markets: Global Wipes Market 2014-2018: Johnson & Johnson Inc., Kao Corp., Kimberly-Clark Corp., and Procter & Gamble Co. Dominate the Market",http://www.reuters.com/article/2014/05/12/research-and-markets-idUSnBw126556a+100+BSW20140512,
20140512 8:00AM UTC,"Earnings Results, Agreements, Study Results, FDA Approvals, and Drug Trial Results - Analyst Notes on Merck, Johnson & Johnson, GlaxoSmithKline, Novartis and Intercept",http://www.reuters.com/article/2014/05/12/bc-ar-idUSnPn5YYpMv+9a+PRN20140512,
20140513 7:29AM UTC,"Research and Markets: Global Tampons Market 2014-2018: Energizer Holdings Inc, Johnson & Johnson Inc, Kimberly-Clark Corp & Procter & Gamble Co. Dominates",http://www.reuters.com/article/2014/05/13/research-and-markets-idUSnBw135896a+100+BSW20140513,
20140521 11:27AM UTC,"Market Movers - Health Care Sector Stocks -- Research on VCA Antech, MEDNAX, Lannett, and Johnson & Johnson",http://www.reuters.com/article/2014/05/21/bc-investor-edge-idUSnPn5WTdlP+99+PRN20140521,
20140521 8:42AM UTC,"Marketing Authorizations, Study Results Presentations, FDA Response to Drug Application, and New Messaging Services - Analyst Notes on Johnson & Johnson, Merck, Celgene, Novartis and UnitedHealth",http://www.reuters.com/article/2014/05/21/bc-analysts-review-idUSnPn11QdLs+8a+PRN20140521,
20140522 8:45AM UTC,Johnson & Johnson Medical Devices & Diagnostics Businesses Expanding Market Leadership with Innovative Products and Customer-Focused Solutions,http://www.reuters.com/article/2014/05/22/nj-johnson-johnson-idUSnPn1lZV9j+8c+PRN20140522,
20140529 8:00AM UTC,Aduro Announces License Agreement with Johnson & Johnson Innovation for Novel Immunotherapies for Prostate Cancer,http://www.reuters.com/article/2014/05/29/ca-aduro-biotech-idUSnBw295343a+100+BSW20140529,
20140529 7:57AM UTC,China fines Johnson & Johnson and others for price fixing,http://www.reuters.com/article/2014/05/29/us-china-penalty-idUSKBN0E915920140529,
20140529 7:53AM UTC,China fines Johnson & Johnson and others for price fixing,http://www.reuters.com/article/2014/05/29/china-penalty-idUSL3N0OF2U520140529,
20140529 6:50AM UTC,"Launch of Ultrasonic Device, Conference Participation, Public Offering, and Employee Stock Options - Analyst Notes on Johnson & Johnson, McKesson, AmerisourceBergen, Horizon Pharma and Sanofi",http://www.reuters.com/article/2014/05/29/bc-ar-idUSnPnbS1K0x+94+PRN20140529,
20140530 5:33PM UTC,Hysterectomy Cancer Lawsuit: Bernstein Liebhard Notes Report Indicating Johnson & Johnson Was Warned About Morcellator Cancer Risks in 2006,http://www.reuters.com/article/2014/05/30/ny-bernsteinlawreport-idUSnPnb39jLX+83+PRN20140530,
20140530 1:21PM UTC,"Research and Markets: Endothelial Dysfunction - Pipeline Review, H1 2014: Johnson & Johnson, Chugai Pharmaceutical Co., Ltd., Glucox Biotech AB & Stealth Pep",http://www.reuters.com/article/2014/05/30/research-and-markets-idUSnBw305740a+100+BSW20140530,
20140603 9:30AM UTC,"Gorman Rupp, American Vanguard, Pharmacyclics, GlaxoSmithKline andJohnson & Johnson highlighted as Zacks Bull and Bear of the Day",http://www.reuters.com/article/2014/06/03/il-zacks-investment-idUSnPn1xQjDh+8a+PRN20140603,
20140604 3:01PM UTC,Johnson & Johnson Reinforces Importance of Children Learning the Value of Care from their Parents as Part of CARE INSPIRES CAREâ„¢ Program,http://www.reuters.com/article/2014/06/04/johnsonjohnson-care-idUSnPn9TmsFz+92+PRN20140604,
20140605 12:30PM UTC,"Johnson & Johnson Announces U.S. Champions of Care"" as Part of 2014 FIFA World Cup Brazilâ„¢ Sponsorship""",http://www.reuters.com/article/2014/06/05/nj-johnsonjohnson-idUSnPn1TXxqV+99+PRN20140605,
20140605 6:10AM UTC,"Study Results, Updated Organization Structures, Appointments, and Technical Updates - Analyst Notes on Johnson & Johnson, Pfizer, Teva, Express Scripts and Idenix Pharmaceuticals",http://www.reuters.com/article/2014/06/05/bc-ar-idUSnPn7gWV5M+8d+PRN20140605,
20140612 6:25PM UTC,Corporate Action Network and Injured Women Call on Illinois Attorney General to Investigate Johnson & Johnson,http://www.reuters.com/article/2014/06/12/il-corp-action-network-idUSnBw126467a+100+BSW20140612,
20140612 6:21PM UTC,Corporate Action Network and Injured Women Call on Mississippi Attorney General to Investigate Johnson & Johnson,http://www.reuters.com/article/2014/06/12/ms-corp-action-network-idUSnBw126465a+100+BSW20140612,
20140612 9:30AM UTC,"The Zacks Analyst Blog Highlights: Pepsico, Nike, Yingli Green Energy Holding and Johnson & Johnson",http://www.reuters.com/article/2014/06/12/il-zacks-investment-idUSnPn2SDBzt+9c+PRN20140612,
20140613 6:00AM UTC,"Approvals, Agreements, Name Change, and Partnerships - Analyst Notes on Johnson & Johnson, Furiex Pharmaceuticals, Select Medical, CTI and Hill-Rom",http://www.reuters.com/article/2014/06/13/bc-analysts-review-idUSnPn8hZsWH+8b+PRN20140613,
20140616 9:30AM UTC,"The Zacks Analyst Blog Highlights: Johnson & Johnson, GlaxoSmithKline, Pfizer  and Gilead Sciences",http://www.reuters.com/article/2014/06/16/il-zacks-analyst-blog-idUSnPn4G8CBR+97+PRN20140616,
20140617 5:00PM UTC,Johnson & Johnson to Host Investor Conference Call on Second-Quarter Results,http://www.reuters.com/article/2014/06/17/johnsonjohnson-conf-idUSnPn8H6Hcx+94+PRN20140617,
20140617 9:30AM UTC,"RF Micro Devices, Select Income Reality, TriQuint Semi, Medtronic,Covidien, Johnson & Johnson, iShares U.S. Medical Devices ETF, Pfizer and AstraZeneca highlighted as Zacks Bull and Bear of the Day",http://www.reuters.com/article/2014/06/17/il-zacksinvestment-idUSnPn8HB3Xt+9a+PRN20140617,
20140619 3:45PM UTC,Corporate Action Network and Florida Women Demand State Investigation of Johnson & Johnson for Dangerous Mesh Implants,http://www.reuters.com/article/2014/06/19/fl-can-call-for-action-idUSnBw196500a+100+BSW20140619,
20140619 8:00AM UTC,"Johnson & Johnson Innovation Catalyzes New and Exciting Science and Technology in Pharmaceutical, Medical Device, Diagnostic and Consumer Healthcare Spaces",http://www.reuters.com/article/2014/06/19/nj-johnson-johnson-idUSnPn6pQXFB+8f+PRN20140619,
20140619 8:00AM UTC,"CEO and Chairman of UPS, D. Scott Davis, Joins Johnson & Johnson Board of Directors",http://www.reuters.com/article/2014/06/19/johnsonjohnson-elect-idUSnPn5Tjntp+90+PRN20140619,
20140620 2:00PM UTC,Corporate Action Network and South Carolina Women Call For State Investigation Into Johnson & Johnson for Dangerous Mesh Implants,http://www.reuters.com/article/2014/06/20/sc-can-call-for-action-idUSnBw205725a+100+BSW20140620,
20140620 6:10AM UTC,"Conference Call Schedules, Acquisitions, and Public Offerings - Analyst Notes on Johnson & Johnson, Merck, GW, Endocyte and AVEO",http://www.reuters.com/article/2014/06/20/bc-analysts-review-idUSnPn6bwD7D+85+PRN20140620,
20140623 9:30AM UTC,"The Zacks Analyst Blog Highlights: Intel, Boeing, Chevron, Johnson & Johnson and Vertex Pharmaceuticals",http://www.reuters.com/article/2014/06/23/il-zacksinvestment-idUSnPn4bLpDV+8b+PRN20140623,
